DOI,Titulo_Tokens,Abstract_Tokens,Autores,Fecha,Seccion
10.1038/s41572-025-00600-x,primary sclerose cholangitis,primary sclerose cholangitis psc be chronic biliary inflammation associate periductular fibrosis intrahepatic extrahepatic bile duct lead stricture bacterial cholangitis decompensate liver disease need liver transplantation rare focal liver disease affect race age predominance young male be to association inflammatory bowel disease aetiology be unknown pathophysiology be poorly understand psc be regard autoimmune liver disease base strong immunogenetic background far associated risk various malignancy particularly cholangiocellular carcinoma be also poorly understand medical therapy have be approve so far have be show to improve transplant free survival however ursodeoxycholic acid be widely use improve biochemical parameter cholestasis be safe low dose mri biliary tract be primary imaging technology diagnosis endoscopic intervention bile duct should be limit clinically relevant stricture balloon dilatation biopsy brush cytology end stage liver disease decompensation be indication liver transplantation recurrent psc in to patient several novel therapeutic strategy be various stage development include apical sodium dependent bile acid transporter ileal bile acid transporter inhibitor integrin inhibitor peroxisome proliferator activate receptor agonist blocker recombinant inhibitor farnesoid x receptor bile acid receptor agonist ursodeoxycholic acid manipulation gut microbiome include faecal microbiota transplantation article summarize present knowledge define unmet medical need to improve quality life survival,"Manns, Michael P,Bergquist, Annika,Karlsen, Tom H,Levy, Cynthia,Muir, Andrew J,Ponsioen, Cyriel,Trauner, Michael,Wong, Grace,Younossi, Zobair M",07/02/2025,Nature reviews. Disease primers
10.1126/sciadv.adr3757,genetically support target drug repurpose brain aging systematic study uk biobank,brain age gap bag deviation estimate brain age chronological age be promising marker brain health however genetic architecture reliable target brain aging remains poorly understand study estimate magnetic resonance imaging brain age use deep learning model train uk biobank validate three external dataset genome wide association study bag identify two unreported loci seven previously report loci integrate mendelian randomization mr colocalization analysis eqtl pqtl datum prioritize seven genetically support druggable gene include mapt gzmb gnly nmb promise target brain aging rediscover potential drug evidence clinical trial aging prioritize several drug strong genetic support study provide insight genetic basis brain aging potentially facilitate drug development brain aging to extend health span,"Yi, Fan,Yuan, Jing,Somekh, Judith,Peleg, Mor,Zhu, Yi-Cheng,Jia, Zhilong,Wu, Fei,Huang, Zhengxing",12/03/2025,Science advances
10.1681/ASN.0000000681,deficiency r loop pathway kidney injury diabetic nephropathy,background diabetic nephropathy be primary cause kidney failure persistent hyperglycemia cause metabolic perturbation epigenetically dysregulate gene expression renal cell thereby lead diabetic nephropathy pathogenesis analyze geo database use machine learning algorithm preliminary result demonstrate growth arrest dna damage inducible might serve key regulator diabetic nephropathy furthermore emerge evidence have show r loop three strand dna rna structure be crucial gene expression diabetic nephropathy therefore study aim to investigate role diabetic nephropathy modulate epigenetic alteration interaction r loop method diabetic mouse model be establish inject streptozotocin intraperitoneally mouse kidney histology biochemical marker be analyze wild type knockout renal tubule specific overexpresse mouse lentivirus be use to induce overexpression cell high glucose treatment be apply to verify mechanism vitro result expression be reduce kidney diabetic nephropathy correlate kidney dysfunction knockout worsen kidney injury overexpression mitigate mechanistically interact r loop promoter recruit to activate transcription deficiency r loop pathway exacerbate mitochondrial injury disrupt lipid metabolism increase oxidative stress diabetic nephropathy conclusion deficiency exacerbate diabetic nephropathy interact r loop inhibit promoter demethylation target r loop pathway offer therapeutic potential diabetic nephropathy,"Li, Xue Qi,Zhang, Jia Xiu,Li, Liang,Wu, Qin Yi,Ruan, Xiong Zhong,Chen, Pei Pei,Ma, Kun Ling",09/10/2024,Journal of the American Society of Nephrology : JASN
10.1001/jamasurg.2025.0220,neoadjuvant chemoradiotherapy chemoimmunotherapy esophageal squamous cell carcinoma,importance association neoadjuvant chemoimmunotherapy ncit chemoradiotherapy ncrt tumor downstaging survival locally advanced esophageal squamous cell carcinoma escc remain unclear limited evidence objective to compare association ncit ncrt tumor regression long term survival patient locally advanced escc design setting participant comparative effectiveness research study january march patient locally advanced escc undergo esophagectomy follow ncrt ncit be identify prospective database high volume esophageal surgery center china follow up begin date surgery continue last record contact march occur first datum be analyze april september main outcome measure primary end point be year overall survival os disease free survival dfs secondary end point include major pathologic response mpr pathologic complete response pcr cox proportional hazard regression analysis be use to investigate risk factor os dfs result study include patient median iqr age year man patient ncrt group patient ncit group propensity score matching be patient group year os hazard ratio ci p hazard ratio ci p rate be significantly high ncit group ncrt group ncrt group have high mpr rate ncit group pcr rate be similar multivariable cox analysis demonstrate ncit mpr be independently associate os dfs ncit group exhibit low overall recurrence rate patient patient distant metastasis rate patient patient locoregional metastasis rate be similar patient patient well os dfs be obtain ncit group ncrt group regardless adjuvant immunotherapy be give conclusion relevance compare ncrt patient locally advanced escc receiving ncit have well year os dfs decrease distant metastasis may be main reason far prospective randomized clinical trial be need to verify finding,"Guo, Xufeng,Chen, Chunji,Zhao, Jinbo,Wang, Changchun,Mei, Xinyu,Shen, Jianfei,Lv, Huilai,Han, Yongtao,Wang, Qifeng,Lv, Jiahua,Chen, Hainan,Yan, Xiaolong,Liu, Zhichao,Zhang, Zhengyang,Zhong, Qihong,Jiang, Youhua,Xu, Liwei,Li, Xiaoyang,Qian, Dong,Ma, Dehua,Ye, Minhua,Wang, Chunguo,Wang, Zimin,Lin, Jiangbo,Tian, Ziqiang,Leng, Xuefeng,Li, Zhigang",19/03/2025,JAMA surgery
10.1172/JCI184740,atgl link insulin dysregulation insulin resistance adolescent obesity hepatosteatosis,study examine underlie cellular mechanism associate insulin resistance ir metabolic disease risk subcutaneous adipose tissue sit youth obesity ir compare adolescent be insulin sensitive be adolescent ir obesity undergo hour oral glucose tolerance test mri to measure abdominal fat distribution liver fat content lipolysis be determine glycerol turnover infusion adipose triglyceride lipase atgl phosphorylation western blot sit sample biopsie prior minute follow insulin infusion hyperinsulinemic euglycemic clamp turnover suppression hec first step be low participant ir compare be prior insulin infusion activate atgl reflect p atgl atgl ratio be great participant ir compare be suppress response minute insulin exposure participant be not ir lastly great atgl inactivation be associate great glycerol suppression low liver mediate inhibition adipose tissue lipolysis atgl be dysregulate adolescent ir compare be thereby serve vital mechanism link glucose insulin dysregulation ectopic lipid storage work be support fund nih robert leet clara guthrie patterson trust mentor research award,"Slusher, Aaron L,Santoro, Nicola,Vash-Margita, Alla,Galderisi, Alfonso,Hu, Pamela,Tokoglu, Fuyuze,Li, Zhongyao,Tarabra, Elena,Strober, Jordan,Vatner, Daniel F,Shulman, Gerald I,Caprio, Sonia",12/07/2024,The Journal of clinical investigation
10.1016/j.jare.2025.03.017,probiotic enhance donor microbiota stability improve efficacy fecal microbiota transplantation treat colitis,introduction stability metabolic functionality donor microbiota be critical determinant fecal microbiota transplantation fmt efficacy inflammatory bowel disease ibd probiotic show potential to enhance microbiota resilience role optimize donor microbiota fmt remain underexplored objective study investigate pretreatment donor microbiota plantarum could improve fmt outcome dss induce colitis model modulate microbial stability metabolic activity host microbiome interaction method donor mouse receive plantarum week to generate modify fmt mfmt dss colitis mouse be treat mfmt conventional fmt aminosalicylic acid asa multi omics analysis functional assay stress resistance engraftment efficiency be use to evaluate therapeutic mechanism result pretreatment confer three key advantage to donor microbiota ecological stabilization drive acidification ph lgg p enrich butyrogenic butyricicoccus butyrate increase p improve stress resistance bile acid gastric condition survival fmt metabolic reprogramming metabolize tryptophan lgg to generate immunomodulatory indole ila iaa activate aryl hydrocarbon receptor ahr signal upregulate anti inflammatory bile acid remodeling mfmt restore sulfolithocholic acid β mca level outperform fmt resolve dss induce dysregulation mfmt achieve remission rate fmt enhance gut barrier integrity reverse colitis associate metabolic dysregulation elevated spermidine sulfocholic acid probiotic preconditioning improve donor engraftment enrich success associate taxa sporobacter butyricimonas suppress pathogen clostridium papyrosolven conclusion plantarum optimize donor microbiota ph drive niche engineering immunometabolic reprogramming bile acid modulation address key limitation conventional fmt multi targeted efficacy mfmt evidence superior remission rate metabolic restoration establish approach translatable strategy ibd therapy study establish probiotic enhance fmt paradigm precision microbiome intervention,"Fan, Jingjing,Wu, Ying,Wang, Xing,Ullah, Habib,Ling, Zhenmin,Liu, Pu,Wang, Yu,Feng, Pengya,Ji, Jing,Li, Xiangkai",16/12/2024,Journal of advanced research
10.1001/jamanetworkopen.2025.0669,probiotic fever duration child upper respiratory tract infection randomized clinical trial,importance upper respiratory tract infection urtis be prevalent child prompt frequent health care consultation especially fever probiotic show potential adjuvant treatment urtis evidence child be limited objective to evaluate efficacy probiotic mixture contain bifidobacterium breve bifidobacterium lactis lactobacillus rhamnosus shorten fever duration child urtis design setting participant randomize clinical trial be conduct november june pediatric emergency department ca granda ospedale maggiore policlinico milan italy patient day year age fever c urti be eligible exclusion criterion include recent probiotic use chronic autoimmune disease immunosuppressive treatment requirement hospitalization randomization be computer generate assign participant intervention probiotic control placebo group participant parent caregiver investigator be mask group assignments primary analysis follow intention treat approach intervention probiotic group receive daily single dose ml probiotic mixture contain bifidobacterium breve bifidobacterium lactis lactobacillus rhamnosus day placebo group receive daily single dose ml placebo day main outcome measure primary outcome be fever duration define number day first last day fever result patient enrol male mean sd age year be randomly assign to receive placebo to receive probiotic median iqr fever duration be short probiotic group placebo group median iqr day day adjusted risk ratio ci few mild adverse event be report do not significantly differ probiotic placebo group include constipation p abdominal pain p conclusion relevance randomize clinical trial administer probiotic mixture reduce fever duration day compare placebo meaningful safety concern probiotic mixture investigation could be effective adjuvant shorten fever duration child urtis trial registration identifi,"Bettocchi, Silvia,Comotti, Anna,Elli, Marina,De Cosmi, Valentina,Berti, Cristiana,Alberti, Ilaria,Mazzocchi, Alessandra,Rosazza, Chiara,Agostoni, Carlo,Milani, Gregorio Paolo",14/03/2025,JAMA network open
10.1016/j.jhep.2024.11.007,easl ern clinical practice guideline wilson disease,wilson disease be autosomal recessive disorder copper metabolism affect liver brain other organ diagnosis be base clinical feature biochemical test include plasma ceruloplasmin concentration h urinary copper excretion copper content liver molecular analysis leipzig score additionally relative exchangeable copper determination be recommend diagnosis pharmacological therapy comprise chelate agent penicillamine trientine zinc salt only chelator be recommend significant liver disease monitoring be base clinical symptom liver test copper metabolism urinary copper excretion exchangeable copper to detect poor compliance under treatment acute liver failure be challenge make diagnosis be difficult pharmacological therapy may not be sufficient to save life liver transplantation have well define role wilsonian acute hepatic failure may also be consider neurological disease,,08/11/2024,Journal of hepatology
10.1016/j.ygyno.2015.01.552,detection endometrial cancer molecular analysis dna collect vaginal tampon,objective demonstrate feasibility detect ec combine minimally invasive specimen collection technique sensitive molecular testing method prior to hysterectomy ec benign indication woman collect vaginal pool sample intravaginal tampon underwent endometrial brushing specimen underwent pyrosequencing dna methylation gene report to be hypermethylate gynecologic cancer recently identify marker discover profile ec methylation be evaluate individually cpgs average gene difference ec benign endometrium be be assess use two sample t test area curve auc result thirty eight ec bes be include evaluate cpgs gene include previously report marker haao identify discovery work npy mme additional cpg site mean methylation be high tampon specimen ec be gene mme haao gene relative hypermethylation be observe ec be cpgs endometrial brush tampon result be similar tampon specimen auc be high be first report hypermethylation ec conclusion dna hypermethylation ec tissue can also be identify vaginal pool dna collect intravaginal tampon identification additional ec biomarker refined collection method be need to develop early detection tool ec,"Bakkum-Gamez, Jamie N,Wentzensen, Nicolas,Maurer, Matthew J,Hawthorne, Kieran M,Voss, Jesse S,Kroneman, Trynda N,Famuyide, Abimbola O,Clayton, Amy C,Halling, Kevin C,Kerr, Sarah E,Cliby, William A,Dowdy, Sean C,Kipp, Benjamin R,Mariani, Andrea,Oberg, Ann L,Podratz, Karl C,Shridhar, Viji,Sherman, Mark E",17/12/2014,Gynecologic oncology
10.1093/jimmun/vkaf005,sustained activation induce cytidine deaminase aid expression b cell follow plasmodium malaria infection kenyan child,burkitt lymphoma bl be characterize elevated level enzyme activation induce cytidine deaminase aid enzyme critical myc translocation be hallmark bl ebv plasmodium malaria be cofactor etiology bl however pathogen drive bl pathogenesis be not yet understand study test hypothesis falciparum ebv synergize to induce dysregulate expression aid use flow cytometry intracellular aid expression be measure pbmcs cohort child western kenya uncomplicated malaria community control child uncomplicated malaria have elevated level b cell compare control high level aid be sustain to week parasite clearance use imagestream flow cytometry find aid be localize nucleus b cell child malaria to test ebv falciparum synergize to drive expression aid stimulate b cell ebv cpg to mimic dna baff induce falciparum infection combination individually ebv baff cpg induce aid expression however combine be significant increase frequency cell cell treat ebv baff cpg individually collectively datum suggest malaria ebv coinfection result sustained aid expression potentially influence myc translocation be characteristic bl,"Ariera, Bonface,Guyah, Bernard,Rahkola, Jeremy,Arao, Ian,Waomba, Kevin,Koech, Emmily,Samayoa-Reyes, Gabriela,Sabourin, Katherine R,Ogolla, Sidney,Rochford, Rosemary",26/08/2024,"Journal of immunology (Baltimore, Md. : 1950)"
10.1136/bmjebm-2024-112974,analgesic effect non surgical non interventional treatment low back pain systematic review meta analysis placebo control randomised trial,objective to investigate efficacy non surgical non interventional treatment adult low back pain compare placebo eligibility criterion randomise control trial evaluate non surgical non interventional treatment compare placebo sham adult year report non specific low back pain information source medline cinahl embase psychinfo cochrane central register control trial be search inception april risk bias risk bias include study be assess use to pedro scale synthesis result random effect meta analysis be use to estimate pool effect correspond confidence interval outcome pain intensity to scale first assessment post treatment treatment type duration low back week chronic week certainty evidence be assess use grading recommendation assessment grade approach result total trial comparison provide datum different treatment treatment combination one treatment acute low back pain non steroidal anti inflammatory drug nsaid five treatment chronic low back pain exercise spinal manipulative therapy taping antidepressant transient receptor potential vanilloid agonist be efficacious effect size be small moderate certainty three treatment acute low back pain exercise glucocorticoid injection paracetamol two treatment chronic low back pain antibiotic anaesthetic be not efficacious be unlikely to be suitable treatment option moderate certainty evidence evidence be inconclusive remain treatment small sample imprecision low very low certainty evidence conclusion current evidence show one non surgical non interventional treatment low back pain be efficacious provide only small analgesic effect placebo efficacy majority treatment be uncertain limited number randomised participant poor study quality further high quality placebo control trial be warrant to address remain uncertainty treatment efficacy great consideration placebo control design non surgical non interventional treatment trial registration number osf registry,"Cashin, Aidan G,Furlong, Bradley M,Kamper, Steven J,De Carvalho, Diana,Machado, Luciana Ac,Davidson, Simon Re,Bursey, Krystal K,Abdel Shaheed, Christina,Hall, Amanda M",10/11/2024,BMJ evidence-based medicine
10.1016/j.ajcnut.2025.03.006,individualized nutritional intervention routine care gestational diabetes prevention randomized control trial,background gestational diabetes mellitus gdm affect million female child effective dietary strategy early prevention be controversial objective to investigate individualized nutritional intervention reduce gdm incidence high risk female method randomized trial be conduct three tertiary hospital shanghai china randomly assign pregnant woman first trimester be identify to be high risk gdm prediction model individualized nutritional intervention usual care intervention consist three dietary consultation dietitian base chinese dietary guideline oral glucose tolerance test ogtt gestational week control group receive usual care participant provide day food record follow up primary outcome be gdm incidence use international association diabete pregnancy study group criterion key secondary outcome be dietary alteration gestational weight gain gwg maternal metabolic profile perinatal pregnancy outcome intention to treat analysis be conduct result total female be enrol be assign intervention usual care gdm be diagnose female intervention group compare control group adjust relative risk ci more female intervention group have appropriate gwg control group low level fast hour insulin ogtt observe reduction rate small gestational age intervention group compare control group neonatal hypoglycemia conclusion female risk gdm individualized nutritional intervention base chinese dietary guideline provide ogtt do not prevent gdm help to manage gwg appropriately improve pregnancy outcome trial registration chictr register oct initial participant enrollment may note url,"Wang, Lulu,Wang, Xipeng,Zhang, Rong,Sun, Wenguang,Zhang, Chenjie,Zhang, Chen,Qin, Guoyou,Peng, Jiahuan,Li, Hong,Fan, Jianxia,Qu, Lei,Ma, Liying,Chen, Lei,Wu, Jiaying,Hao, Yanhui,Ruan, Huijuan,Zheng, Tao,Wu, Dongling,Li, Shaojing,Liu, Yanyan,Wang, Man,Lu, Huan,Dennis, Cindy-Lee,Mol, Ben W,Huang, Hefeng,Wu, Yanting",25/08/2024,The American journal of clinical nutrition
10.1002/ajh.27666,waldenström macroglobulinemia update diagnosis risk stratification management,disease overview waldenström macroglobulinemia wm be lymphoplasmacytic lymphoma immunoglobulin m igm monoclonal protein clinical feature include anemia thrombocytopenia hepatosplenomegaly lymphadenopathy rarely hyperviscosity diagnosis presence igm monoclonal protein associate clonal lymphoplasmacytic cell bone marrow confirm diagnosis mutation be detectable more patient be find most igm mgus patient be not require diagnosis risk stratification age albumin hemoglobin level platelet count microglobulin lactate dehydrogenase ldh monoclonal igm concentration be characteristic be predictive outcome risk adapt therapy not patient fulfill wm criterion require therapy patient can be observe symptom develop rituximab monotherapy be inferior combination regimen recommend first line therapy can be chemoimmunotherapy covalent bruton tyrosine kinase inhibitor preferred mayo clinic induction be rituximab bendamustine rituximab maintenance zanubrutinib management refractory disease bortezomib cyclophosphamide fludarabine thalidomide everolimus pirtobrutinib carfilzomib lenalidomide bendamustine venetoclax have all be show to have activity relapse wm give wm natural history reduction therapy toxicity be important part treatment selection most patient succumb cause unrelated macroglobulinemia,"Gertz, Morie A",26/02/2025,American journal of hematology
10.1172/JCI190957,macrophage key conductor perivascular inflammation vascular remodeling hypoxia induce pulmonary hypertension,pulmonary hypertension ph encompass heterogenous group disorder common feature increase pulmonary arterial pressure patient ph associate lung disease hypoxia undergo immune mediate vascular remodeling include thickening muscular layer surround artery arteriole issue jci kumar colleague examine role interstitial macrophage model high altitude ph resident interstitial macrophage increase proliferated express monocyte chemoattractant ligand be also rise macrophage express be know to activate vascular remodeling tgf β block monocyte recruitment partially reduce hypoxic ph corticosteroid treatment effectively reduce expression monocyte recruitment far plasma sample collect individual ascend low high altitude show increase tgf β level be reduce dexamethasone finding reveal interstitial macrophage population potential therapeutic target hypoxic ph,"Spiekerkoetter, Edda",17/03/2025,The Journal of clinical investigation
10.1111/epi.18357,effectiveness safety adjunctive cenobamate people focal onset epilepsy interim result week observational period bless study,objective cenobamate be antiseizure medication asm dual mechanism action be recently approve treatment focal seizure adult analysis aim to describe outcome week start cenobamate therapy real world setting method bless be ongoing observational retrospective prospective cohort study to evaluate real world effectiveness safety adjunctive cenobamate adult uncontrolled focal epilepsy subgroup analysis be perform subject to previous asm early user previous asm late user result second interim analysis bless study include participant median interquartile range age year have median prior asm median monthly seizure baseline median monthly seizure frequency be reduce baseline week subject have seizure frequency reduction show sustained seizure freedom proportion participant take concomitant asm increase baseline week early user median reduction monthly seizure frequency week be subject have response rate frequency adverse drug reaction adrs be early late user most frequent adr be somnolence dizziness balance disorder occurrence adr participant maintain prescribed dose permanently discontinue treatment significance cenobamate be effective reduce seizure frequency real world setting show manageable safety profile treatment cenobamate also reduce burden concomitant asm early late user,"Lattanzi, Simona,Dono, Fedele,d'Orsi, Giuseppe,D'Aniello, Alfredo,Panebianco, Mariangela,Bonanni, Paolo,Di Bonaventura, Carlo,Montalenti, Elisa,Gambardella, Antonio,Ranzato, Federica,Pauletto, Giada,Tartara, Elena,La Neve, Angela,Bisulli, Francesca,Vatti, Giampaolo,Pulitano, Patrizia,Liguori, Claudio,Assenza, Giovanni,Giordano, Alfonso,Pignatta, Pietro,Belcastro, Vincenzo,Cecconi, Michela,Beretta, Simone,Pizzanelli, Chiara,Pezzella, Marianna,Gangitano, Massimo,Elia, Maurizio,Renna, Rosaria,Vollono, Catello,Pascarella, Angelo,Tramacere, Luciana,De Maria, Giovanni,Audenino, Daniela,Pasolini, Maria Pia,Giuliano, Loretta,Galli, Rosita,Strigaro, Gionata,Puligheddu, Monica,Labate, Angelo,Penza, Pietro,Quadri, Stefano,Stokelj, David,Boero, Giovanni,Fallica, Elisa,Santo Sabato, Monica,Falcicchio, Giovanni,Foschi, Nicoletta,Procaccini, Michela,Villano, Valentina,Camattari, Gabriele,Mele, Fabiano,Roncari, Barbara,Di Gennaro, Giancarlo",13/02/2025,Epilepsia
