DOI,Titulo_Tokens,Abstract_Tokens,Autores,Fecha,Seccion
10.2147/DDDT.S512872,enhance diabete treatment compare pioglitazone metformin dapagliflozin basal insulin metformin type diabetes,aim aim study be to compare efficacy safety fix dose combination fdc pioglitazone metformin supplement dapagliflozin test group basal insulin supplement metformin control group patient inadequately control type diabetes mellitus dm method week prospective randomize open label study enrol patient age year glycated hemoglobin level primary endpoint be proportion patient achieve week hypoglycemia weight gain secondary endpoint include blood glucose lipid profile body weight body mass index inflammatory marker bone gla protein liver enzyme patient satisfaction result full analysis set participant significant difference be observe primary endpoint test group control group however test group have high percentage patient achieve week hypoglycemia experience weight loss patient test group kg also achieve substantial achievement rate test group also exhibit great reduction body weight improvement hour postprandial glucose level systolic blood pressure lipid profile notably combination therapy do not increase risk hypoglycemia weight gain patient test group be more satisfied control group continue to accept pioglitazone metformin fdc combine dapagliflozin conclusion absence contraindication pioglitazone metformin fdc supplement dapagliflozin may serve safe effective alternative basal insulin combine metformin rectify inadequate glucose control former enable metabolic improvement compromise safety chinese clinical trial registry number,"Lin, Yi,Shi, Jianxia,Yu, Xuemei,Sun, Jiao,Lixia, Suo,Dou, Jiaqing,Zhang, Min,Li, Xiaohua,Tian, Zhufang,Deng, Hongyan,Feng, Bo,Su, Qing,Peng, Yongde",17/12/2024,"Drug design, development and therapy"
10.1161/CIRCULATIONAHA.124.072855,withdrawal guideline direct medical therapy patient heart failure improved ejection fraction,background limited evidence exist prognostic role continue medical therapy patient heart failure hf ejection fraction ef have improve time study assess rate patient profile association morbidity mortality renin angiotensin inhibitor rasi angiotensin receptor neprilysin inhibitor arni beta blocker bbl mineralocorticoid receptor antagonist mra withdrawal patient hf improved ef method patient first record ef late ef swedish hf registry june december be include retrospective observational study withdrawal be define patient treatment first reduced not second improve registration association withdrawal time first cardiovascular mortality hospitalization hf censor year be assess cox regression model use overlap weighting result patient hf improved ef median age year percentile woman receive rasi arni bbl mra respectively ef be withdrawal rate time improved ef registration be rasi arni bbl mra predictor withdrawal include low use other hf medication high ef later ef registration long time ef assessment weighting withdrawal be independently associate high risk cardiovascular mortality hospitalization hf rasi arni mra not bbl withdrawal bbl be associate high risk primary outcome subgroup patient improved ef to p interaction conclusion patient hf improved ef hf therapy withdrawal be rare withdraw rasi arni mra be associate high mortality morbidity year association be find bbl withdrawal significant heterogeneity ef improvement suggest well outcome continue bbl only ef improve up to result be hypothesis generating highlight need randomize control trial test bbl withdrawal patient hf improved ef,"Basile, Christian,Lindberg, Felix,Benson, Lina,Guidetti, Federica,Dahlström, Ulf,Piepoli, Massimo Francesco,Mol, Peter,Scorza, Raffaele,Maggioni, Aldo Pietro,Lund, Lars H,Savarese, Gianluigi",17/03/2025,Circulation
10.1186/s12951-025-03284-3,functional nanozyme system synergistic tumor immunotherapy cuproptosis ferroptosis activation,elevated copper level induce tumor cuproptosis ferroptosis lead immunogenic cell death subsequent antitumor immune response however dysregulate copper metabolism tumor cell maintain homeostatic copper balance hypoxic microenvironment hinder therapeutic efficacy study present nanozyme system termed cussomep comprise copper base nanovector cussnv be pegylate load omeprazole copper transporter inhibitor to enhance tumor synergistic immunotherapy promote cuproptosis ferroptosis cussnv be assemble dithiodiglycolic acid copper ion exhibit peroxidase glutathione oxidase catalase like activity responsive degradability nanozyme alleviate tumor hypoxia produce oxygen induce ferroptosis generation lethal hydroxyl radical deplete glutathione additionally omeprazole increase cellular copper concentration oxidative stress inhibit intracellular copper transport atpase enhance lipoylate protein oligomerization cuproptosis breast tumor mouse model cussomep elicit robust antitumor immune response include dendritic cell maturation t cell proliferation combine antibody cussomep significantly inhibit tumor metastasis bilateral lung metastatic model work present functional nanozyme system promising strategy synergistic tumor immunotherapy leverage ferroptosis cuproptosis,"Gu, Lina,Sun, Ying,Bai, Tingjie,Shao, Sijie,Tang, Shumin,Xue, Panpan,Cai, Wanlin,Qin, Xian,Zeng, Xuemei,Yan, Shuangqian",14/12/2024,Journal of nanobiotechnology
10.1007/s12035-025-04829-1,dna methylation regulate promote progression parkinson disease,recent study suggest palmitoylation may influence protein involve neurotransmission neurodegenerative change such pathological α synuclein however role palmitoylation parkinson disease pd have not be systematically investigate additionally finding dna methylation change pd associate gene expression remain inconsistent study aim to explore causal relationship mechanism palmitoylation gene dna methylation pd use mendelian randomization mr study employ two sample mr analysis summary data base mendelian randomization smr analysis mediation analysis utilize pd gwa datum finngen database palmitoylation gene datum eqtlgen database dna methylation datum godmc database first two sample mr analysis be use to evaluate causal relationship palmitoylation gene pd then smr method be apply to validate association gene expression pd finally mediation analysis be conduct to explore mediating effect dna methylation relationship expression palmitoylation gene pd study find significant positive correlation high expression gene increase pd risk standard deviation increase expression be associate increase pd risk far dna methylation analysis identify two key methylation site indirectly influence occurrence pd regulate expression gene mediation effect analysis reveal methylation site indirectly promote development pd regulate expression gene mediation effect gene expression account total effect respectively sensitivity analysis smr analysis support finding indicate high statistical robustness study highlight role dna methylation regulating pd progression suggest potential clinical application such biomarker therapeutic target early pd diagnosis treatment,"Liao, Jing,Bei, Liyuan,Nie, Pengbing,Liu, Pinjing,Zhang, Yongquan",09/01/2025,Molecular neurobiology
10.1016/j.jaci.2025.02.034,cigarette smoke induce epithelial cell ferroptosis promote neutrophilic inflammation patient nasal polyp,background regulation epithelial cell death have emerge key mechanism maintain immune homeostasis airway however mechanism govern epithelial cell survival nasal polyp nps remain poorly understand objective to investigate ferroptosis nasal epithelial cell implication pathogenesis nps method cell death lipid peroxidation ferrous iron level nasal epithelial cell be determine flow cytometry biomarker signal pathway associate ferroptosis be evaluate quantitative rt pcr single cell bulk rna sequence immunofluorescence stain western blotting human nasal epithelial cell hnecs cell be stimulate different agent mitochondrial ultrastructure hnec be visualize transmission electron microscopy cytokine level be quantify use elisa cigarette smoke extract mouse model be establish treat deferoxamine result nasal epithelial cell eosinophilic noneosinophilic nps show intensify lipid peroxidation alter mitochondrial morphology resemble feature ferroptosis ferroptosis trigger c x c motif ligand production cell hnec activation mitogen activate protein kinase pathway cse exposure elevate ferrous iron level upregulate transferrin receptor lead to ferroptosis subsequent production hnecs deferoxamine treatment inhibit nasal epithelial cell ferroptosis level neutrophilic number cse induce mice model smoking burden be correlate level neutrophil infiltration patient nps analysis uk biobank participant reveal smoking risk factor nps odd ratio confidence interval p conclusion smoking induce ferroptosis promote production nasal epithelial cell thus potentially exacerbate neutrophilic inflammation nps,"Pan, Li,Yu, Ze,Xiang, Wen-Xuan,Sun, Shi-Ran,Li, Jing-Xian,Deng, Yi-Ke,Wang, Meng-Chen,Zhong, Ji-Xin,Huang, Kun,Gao, Pei-Song,Zhu, Li-Ping,Yao, Yin,Liu, Zheng",02/09/2024,The Journal of allergy and clinical immunology
10.1038/s41591-025-03515-y,hospital admission attributable reduce air pollution clean air policy china,air pollution prevention control action plan appcap be consider to be most stringent air pollution control policy china implement policy be milestone china to mitigate serious air pollution however health benefit attributable reduce fine particulate air pollution implementation appcap have not be quantitatively estimate constituent specific morbidity cause specific basis here conduct nationwide case crossover study base hospital admission record chinese city compare annual average concentration black carbon bc decrease respectively result average relative reduction annual attributable fraction nine major cause specific hospital admission associate bc be respectively annual attributable fraction depression show large reduction nationally city high reduction bc be find to have high absolute reduction annual hospital admission attributable fraction associate bc geographic inequality health benefit still exist study highlight substantial wide range health benefit reduce bc level follow nationwide implementation appcap china,"Liu, Huimeng,Lei, Jian,Liu, Yuewei,Zhu, Tong,Chan, Kahung,Chen, Xi,Wei, Jing,Deng, Furong,Li, Ge,Jiang, Yunxing,Bai, Lijun,Wang, Kai,Chen, Juan,Lan, Yang,Xia, Xi,Wang, Jinxi,Wei, Chen,Li, Yinxiang,Chen, Renjie,Gong, Jicheng,Duan, Xiaoli,Zhang, Kai,Kan, Haidong,Shi, Xiaoming,Guo, Xinbiao,Wu, Shaowei",08/07/2024,Nature medicine
10.1016/j.waojou.2025.101034,wao aria consensus chronic cough executive summary,acute cough be highly prevalent symptom clinical practice chronic cough be complex disease significant impact quality life mechanistic pathway chronic cough cough comorbid clinical phenotype be elusive mount evidence suggest presence hypersensitive cough reflex implication transient receptor potential channel receptor cough neuronal pathway previously world allergy organization rhinitis impact asthma aria joint committee chronic cough publish update experimental clinical datum chronic cough addition multidisciplinary care pathway approach management goal manuscript be to provide clinician succinct summary chronic cough pathophysiology clinical phenotype management strategy primary cough specialty care executive summary be primer clinician chronic cough increase awareness topic primary care physician will improve outcome management patient chronic cough,"Rouadi, Philip W,Idriss, Samar A,Bousquet, Jean,Morais-Almeida, Mario,Azar, Cecilio R,Al-Ahmad, Mona Sulaiman,Yáñez, Anahí,Ali Y Al-Nesf, Maryam,Nsouli, Talal M,Bahna, Sami L,Abou-Jaoude, Eliane,Zaitoun, Fares H,Hadi, Usamah M,Scadding, Glenis K,Smith, Peter K,Gómez, René Maximiliano,González-Díaz, Sandra N,Klimek, Ludger,Juvelekian, Georges S,Riachy, Moussa A,Canonica, Giorgio Walter,Peden, David,Wong, Gary W K,Sublett, James,Bernstein, Jonathan A,Wang, Lianglu,Tanno, Luciana Kase,Chikhladze, Manana,Levin, Michael,Chang, Yoon-Seok,Martin, Bryan L,Caraballo, Luis,Custovic, Adnan,Ortega-Martell, José Antonio,Ly Lesslar, Olivia J,Giavina-Bianchi, Pedro,Papadopoulos, Nikolaos,Hossny, Elham,Ebisawa, Motohiro,Fiocchi, Alessandro,Ansotegui, Ignacio J",29/08/2024,The World Allergy Organization journal
10.1182/blood.2024026588,loss permit transcriptional activity cellular growth multiple myeloma,multiple myeloma mm be complex hematological malignancy characterize genomic change transcriptomic dysregulation initial exome sequence approach have fail to identify single frequent mutation code genome however use whole genome sequencing wgs find one genomic region most frequently mutate mm patient be untranslated utr region intron gene rna seq datum large cohort suggest loss expression large majority mm patient compare normal plasma cell loss function panel mm cell line lead highly proliferative phenotype vitro vivo ectopic expression significantly reduce cell viability suggest tumor suppressor function mm study cellular molecular effect loss observe endow myeloma cell proliferative potential cooperation plasma cell define transcription factor be involve direct protein protein interaction limit dna bind activity loss thus enhance expression associate cytokine reduce mitochondrial metabolism ro level study therefore suggest loss provide necessary molecular change to allow mediate transcriptional activity mm cell growth survival,"Chakraborty, Chandraditya,Talluri, Srikanth,Binder, Moritz,Morelli, Eugenio,Mayoral, Jessica Encinas,Derebail, Sanika,Aktas Samur, Anil,Epstein, Charles B,Anderson, Kenneth C,Shammas, Masood A,Samur, Mehmet K,Fulciniti, Mariateresa,Munshi, Nikhil C",24/01/2025,Blood
10.1016/j.biortech.2011.11.059,novel efficient method immobilization thermolysin use sodium chloride salting in consecutive microwave irradiation,sodium chloride salting microwave irradiation be combine to drive thermolysin molecule mesoporous support to obtain efficiently immobilized enzyme concentration sodium chloride be m microwave power be w enzyme be couple support min maximum specific activity immobilized enzyme be u be fold increase activity enzyme immobilize use conventional technique fold increase free enzyme additionally thermal stability immobilize thermolysin be significantly improve incubate c be reduction activity free thermolysin lose most activity immobilization also protect thermolysin organic solvent denaturation microwave assist immobilization technique combine sodium chloride salting could be apply other sparsely soluble enzyme immobilization simplicity high efficiency,"Chen, Feifei,Zhang, Fangkai,Du, Fangchuan,Wang, Anming,Gao, Weifang,Wang, Qiuyan,Yin, Xiaopu,Xie, Tian",29/08/2011,Bioresource technology
10.1186/s12974-025-03405-7,unlock therapeutic potential tumor derive evs ischemia reperfusion breakthrough perspective glioma stroke,clinical study have reveal bidirectional relationship glioma ischemic stroke evidence spatial overlap two condition connection arise significant similarity pathological process include regulation cellular metabolism inflammation coagulation hypoxia angiogenesis neural repair involve common biological factor significant share feature disease be crucial role extracellular vesicle evs mediate intercellular communication extracellular vesicle characteristic bilayer structure encapsulate protein lipid nucleic acid shield enzymatic degradation ribonuclease deoxyribonuclease protease structural protection facilitate long distance intercellular communication multicellular organism glioma evs be pivotal intracranial signal shape tumor microenvironment importantly cargo carry glioma derive evs closely align biological factor involve ischemic stroke underscore substantial impact glioma stroke pathology particularly crucial role evs key mediator interaction review explore pathological interplay glioma ischemic stroke address clinical manifestation pathophysiological process stage hypoxia stroke onset progression recovery particular focus crucial role evs cargo interaction,"Hao, Zhongnan,Guan, Wenxin,Wei, Wei,Li, Meihua,Xiao, Zhipeng,Sun, Qinjian,Pan, Yongli,Xin, Wenqiang",12/01/2025,Journal of neuroinflammation
10.1073/pnas.2420466122,atlas early human mandibular endochondral osteogenic paracrine signal region meckel cartilage,mandible also know low jaw be only bone skull can move be essential speak chew meckel cartilage mc be temporary structure support formation mandible mc be involve ossification mandible be poorly understand use single cell rna sequence single cell spatial transcriptomic analysis spatiotemporal atla mc human fetus to wk postconception be establish highlight role mc ossification mandible importantly reveal two population mc contribute mandibular ossification different mechanism anterior mc can differentiate osteolineage cell show vivo lineage trace mouse model intermediate mc facilitate intramembranous ossification cell cell communication possibly signal ligand pdgfc study suggest mc play crucial role mediate mandibular ossification distinct mechanism provide valuable insight understand oral craniofacial disease disorder future,"Shen, Zongshan,Zhang, Ran,Chen, Xinyue,Yang, Guan,Si, Yuanchun,Yan, Tianxing,Chen, Suwen,Cheng, Bin,Wu, Xiaoshan,Chen, Di,Zhang, Dong,Xiao, Guozhi,Zhu, Jian-Kang,Wang, Songlin",17/03/2025,Proceedings of the National Academy of Sciences of the United States of America
10.1016/j.jaci.2025.02.038,deficiency important form common variable immunodeficiency inflammation,background interferon regulatory bind be transcription factor play important role regulate immune pathway angiogenesis apoptosis cell differentiation defect gene have be implicate immunodeficiency objective to deepen understanding clinical implication variant seek to clinically characterize functionally test thirty four individual variant method collect subject family mutation record be abstract clinical phenotype functional testing be perform peripheral blood mononuclear cell pbmcs nuclear factor activate t cell nfat luciferase gene reporter construct quantitative cdna determination be use to evaluate repressor activity associate ectopic expression various mutant construct jurkat cell result most subject have immunodeficiency variable gastrointestinal inflammatory autoimmune feature include chronic abdominal pain colitis diarrhea constipation vitiligo alopecia migratory rash be reduce frequency memory b cell poor immunoglobulin production reduce calcium flux response b cell receptor stimulus pbmcs have increase apoptosis vitro compare healthy control impair repression nfat activation be observe use patient derive mutant construct compare wild type similarly tnf α transcript level be high use patient derive mutation compare wild type construct conclusion deficiency cause complex immunodeficiency include gastrointestinal inflammatory disorder as well impair b cell maturation impaired repression nfat pathway appear to enhance proinflammatory signal proinflammatory cytokine expression,"Udemgba, Chioma,Pillay, Bethany,Shafer, Samantha,Alberstadt, Angelika,Abers, Michael,Gilliaux, Olivier,Chen, Karin,Rae, William,Hanitsch, Leif,Von Bernuth, Horst,Neves, Joao Farela,Raje, Nikita,Moens, Leen,van Hagen, P Martin,Bergerson, Jenna,Hartog, Nicholas,Niehues, Tim,Dückers, Gregor,Falcone, Emilia,Keller, Michael,Hsu, Amy,Meyts, Isabelle,Holland, Steven M",30/11/2023,The Journal of allergy and clinical immunology
10.1016/j.ccell.2025.02.014,target tumor monocyte intrinsic pd rewire sting signal enhance ste agonist therapy,sting be important dna sense machinery initiate immune response therapy target sting have show poor outcome clinical trial here reveal sting signal induce pd tumor monocyte dominate resistance sting agonist therapy cell intrinsic pd induce sting ifn axis be identify drive factor protumoral pd notably activate resist sting induce upregulation cell intrinsic pd associate protumoral function mechanistically stimulation remodel sting signal facilitate sting interaction suppress ifn response enhance nf κb activation moreover demonstrate combine sting agonist agonist pretreatment significantly improve antitumor efficacy murine syngeneic humanize model finding uncover protumoral aspect sting activation mediate cell intrinsic pd propose promising strategy to boost antitumor immunity fine tune sting signal output,"Song, Huan,Chen, Lin,Pan, Xuanxuan,Shen, Yuru,Ye, Maolin,Wang, Guohong,Cui, Can,Zhou, Qi,Tseng, Yujen,Gong, Zheng,Zhong, Bin,Cui, Haoshu,Mo, Shaocong,Zheng, Jiayue,Jin, Bryan,Zheng, Wanwei,Luo, Feifei,Liu, Jie",30/07/2024,Cancer cell
10.1038/s41573-025-01158-9,fibrosis cross organ biology pathway development innovative drug,fibrosis be pathophysiological mechanism involve chronic progressive disease result excessive tissue scarring disease associate fibrosis include metabolic dysfunction associate steatohepatitis mash inflammatory bowel disease ibds chronic kidney disease ckd idiopathic pulmonary fibrosis ipf systemic sclerosis ssc be collectively responsible substantial morbidity mortality few drug direct antifibrotic activity be approve pulmonary fibrosis considerable progress have be make understanding mechanism fibrosis translation knowledge effective therapy continue to be limited challenging aim assist developer novel antifibrotic drug review integrate viewpoint biologist physician scientist core pathway involve fibrosis organ as well specific characteristic approach to assess therapeutic intervention fibrotic disease lung gut kidney skin liver discussion be use basis to propose strategy to improve translation potential antifibrotic therapy,"Rieder, Florian,Nagy, Laura E,Maher, Toby M,Distler, Jörg H W,Kramann, Rafael,Hinz, Boris,Prunotto, Marco",10/02/2025,Nature reviews. Drug discovery
10.1038/s43018-025-00933-2,gremlin express splenic niche cell population restrain chronic myeloid leukemia antagonize bmp pathway,spleen play critical role pathogenesis leukemia however understanding splenic niche be very limited herein report induce expression secrete protein gremlin mouse model restrain chronic myeloid leukemia cml progression synergize tyrosine kinase inhibitor treatment blockade gremlin promote cml development intriguingly effect gremlin be most evident spleen not bone marrow gremlin induce apoptosis leukemic stem cell antagonize bmp pathway single cell rna sequence experimental validation together show gremlin mark unique stromal cell population spleen mouse human genetic ablation gremlin cell lead to accelerate cml progression collectively gremlin gremlin cell be key defensive niche component spleen limit cml progression reveal unprecedented mechanism body to fight leukemia,"Wang, Jinming,Xu, Penghui,Ji, Zhongzhong,Cheng, Chaping,Liu, Yiyun,Du, Genyu,Zhang, Shilei,Miao, Juju,Wang, Deng,Chen, Ruoyang,Li, Dawei,Zhang, Kai,Zhao, Huifang,Sun, Yujiao,Chen, Xinyu,Jing, Na,Liu, Kaiyuan,He, Yuman,Xi, Xialian,Zhang, Yingchao,Wang, Nan,Xu, Longmei,Yao, Jufang,Gao, Xiaomei,Zhou, Jianhua,Fan, Songqing,Wang, Xiaorui,Dong, Shuxian,Chen, Fangli,Hou, Jian,Zhang, Ming,Gao, Wei-Qiang,Shen, Lijing,Zhang, Pengcheng,Zhu, Helen He",09/04/2024,Nature cancer
10.1016/j.celrep.2025.115426,macrophage specific phgdh protect mafld suppress,metabolic dysfunction associate fatty liver disease mafld be progressive disease only one approve treatment currently available hepatic phosphoglycerate dehydrogenase phgdh rate limit enzyme serine biosynthesis pathway regulate mafld development however role macrophage phgdh mafld progression remain unclear here demonstrate lipotoxicity inducer palmitic acid pa significantly increase macrophage phgdh expression phgdh deficiency macrophage promote pa induce inflammatory response myeloid specific phgdh deficiency exacerbate mafld mouse mechanistically tetrameric phgdh bind transform growth factor β activate kinase to inhibit interaction bind protein sequentially suppress activation downstream nf κb mapk signal inhibition activation slow development metabolic dysfunction associate steatohepatitis mash cause myeloid phgdh knockout importantly adeno associate virus mediate phgdh overexpression liver macrophage alleviate mafld mouse collectively result identify macrophage phgdh promising therapeutic agent mafld,"Hu, Penghui,Shan, Xiao,Dong, Hongyuan,Yu, Sujun,Wang, Baochen,Xiong, Hui,Ji, Zemin,Jing, Weijia,Cui, Yan,Li, Zihan,Zhou, Yanzhao,Wang, Zhe,Wang, Jinrong,Tang, Jiuzhou,Wang, Ting,Xie, Keliang,Yu, Qiujing",23/07/2024,Cell reports
10.1182/blood.2024026139,ruxolitinib combine dexamethasone adult patient newly diagnose hemophagocytic lymphohistiocytosis china,hemophagocytic lymphohistiocytosis hlh be severe hyperinflammatory syndrome overall survival adult patient be poor ruxolitinib janus kinase jak inhibitor have show promise treat hlh exert synergistic effect combine dexamethasone pilot study preliminarily demonstrate combination ruxolitinib dexamethasone ru d regimen have high response rate lead favorable short term survival outcome adult hlh patient prospective phase clinical trial propose ru d regimen first line treatment adult newly diagnose hlh unknown trigger identifi total chinese patient be enrol median follow time be month range month os rate primary endpoint be exceed expect month os rate month year os rate be respectively median os lymphoma associate hlh lahs patient be month most patient have nk t cell lymphoma contrast year os rate non lahs patient be overall response rate orr be patient achieve complete response cr ru d regimen overall ru d regimen be well tolerate hlh patient study demonstrate efficacy safety ru d regimen adult newly diagnose hlh unknown trigger warrant phase randomize control study,"Zhou, De,Huang, Xianbo,Zhu, Lixia,Hu, Xuelian,Yang, Xiudi,Xie, Mixue,Huang, Xin,Yu, Fang,Wei, Juying,Ma, Liya,Zhu, Jingjing,Zhao, Shuqi,Xie, Wanzhuo,Tong, Hongyan,Jin, Jie,Ye, Xiujin",27/02/2025,Blood
