DOI,Titulo_Tokens,Abstract_Tokens,Autores,Fecha,Seccion
10.1016/j.eclinm.2025.103125,deep learning base model prediction early recurrence therapy response whole slide image non muscle invasive bladder cancer retrospective multicentre study,background accurate prediction early recurrence be essential disease management patient non muscle invasive bladder cancer nmibc aim to develop validate deep learning base early recurrence predictive model erpm treatment response predictive model trpm whole slide image to assist clinical decision making method retrospective multicentre study include consecutive patient pathology confirm nmibc undergo transurethral resection bladder tumour five centre patient one hospital sun yat sen memorial hospital sun yat sen university guangzhou china be assign training internal validation cohort patient four other hospital third affiliated hospital sun yat sen university zhujiang hospital southern medical university guangzhou china fifth affiliate hospital sun yat sen university zhuhai china shenshan medical centre shanwei china be assign four independent external validation cohort base multi instance ensemble learning erpm be develop to make prediction haematoxylin eosin staining immunohistochemistry stain slide share same architecture erpm trpm be train evaluate cross validation patient receive bacillus calmette guérin bcg performance erpm be mainly evaluate compare clinical model base model integrate model area curve survival analysis be perform to assess prognostic capability erpm finding january september whole slide image patient be include to train validate model erpm be superior clinical base model predict early recurrence internal validation cohort area curve external validation cohort area curve be par integrated model also stratify recurrence free survival significantly p hazard ratio ci trpm perform well predict bcg unresponsive nmibc accuracy interpretation erpm show promising performance predict early recurrence recurrence free survival patient nmibc surgery further validation combination trpm could be use to guide management nmibc funding national natural science foundation china science technology planning project guangdong province national key research development programme china guangdong provincial clinical research centre urological disease science technology project guangzhou,"Jiang, Fan,Hong, Guibin,Zeng, Hong,Lin, Zhen,Liu, Ye,Xu, Abai,Shen, Runnan,Xie, Ye,Luo, Yun,Wang, Yun,Zhu, Mengyi,Yang, Hongkun,Wang, Haoxuan,Huang, Shuting,Chen, Rui,Lin, Tianxin,Wu, Shaoxu",03/11/2024,EClinicalMedicine
10.3389/fnut.2025.1548851,association non highdensity lipoprotein cholesterol high density lipoprotein cholesterol ratio cardiovascular kidney metabolic syndrome evidence nhanes,objective research be to analyze connection nhhr ckd occurrence use nhane will evaluate feasibility nhhr tool predict ckm syndrome offer valuable insight personalized treatment approach population method datum individual age to year be analyze having exclude be pregnant individual incomplete datum ckm syndrome be characterize simultaneous presence ckd cardiometabolic syndrome cms statistical analysis weight logistic regression model be apply account variable such age gender ethnicity educational background marital status lifestyle factor preexist health condition differently restrict cubic spline rcs be apply to investigate possible nonlinear relationship nhhr ckm study result research reveal occurrence ckm syndrome be more prevalent individual age old woman represent affect additionally nhhr level be notably elevate ckm patient compare ckm p nhhr increase prevalence ckm also rise high prevalence high nhhr quartile positive connection nhhr ckm be indicate multivariable logistic regression especially upper quartile nhhr moreover rcs analysis display noteworthy nonlinear connection nhhr ckm occurrence subgroup analysis uncover significant interaction influence bmi hypertension conclusion rise global prevalence ckm syndrome early identification high risk individual use nhhr could inform targeted prevention intervention strategy future research should focus validate nhhr diverse population explore clinical utility as well examine relationship other biomarker metabolic dysfunction to well understand ckm syndrome complex pathophysiology,"Duan, Yang,Yang, Ke,Zhang, Tianai,Guo, Xiangsheng,Yin, Qianran,Liu, He",20/12/2024,Frontiers in nutrition
10.1016/S2468-1253(24)00390-X,intestinal barrier pivotal role health inflammation cancer,intestinal barrier serve boundary mucosal immune system lamina propria external environment intestinal luman contain diverse array microorganism ingest environmental factor include pathogen food antigen toxin other foreign substance barrier have central role regulate control interaction luminal factor intestinal immune system disruption intestinal epithelial cell serve physical barrier antimicrobial peptide mucin produce act chemical barrier can lead leaky gut state intestinal wall be unable to efficiently separate intestinal flora luminal content intestinal immune system subsequent activation immune system have important role pathogenesis inflammatory bowel disease as well metabolic dysfunction associate steatohepatitis primary sclerose cholangitis colorectal cancer dysregulate intestinal barrier integrity have also be describe patient chronic inflammatory disease gastrointestinal tract include rheumatoid arthritis neurodegenerative disorder mechanistic study barrier dysfunction have reveal subsequent local activation systemic circulation activate immune cell cytokine secrete as well extracellular vesicle promote proinflammatory process gastrointestinal tract review summarise finding highlight several new therapeutic concept currently be develop attempt to control inflammatory process direct indirect modulation intestinal barrier function,"Neurath, Markus F,Artis, David,Becker, Christoph",26/09/2024,The lancet. Gastroenterology & hepatology
10.1016/j.ccell.2025.02.026,distinct t cell dynamic associate response neoadjuvant cancer immunotherapy,leverage clinical trial compare neoadjuvant anti anti anti therapy head neck squamous cell carcinoma patient combination therapy promote high pathologic response rate monotherapy major pathologic response be associate well survival to address successful immune checkpoint inhibitor ici regimen act similar distinct pathway robustly longitudinally characterize transcriptional proteomic dynamic tumor infiltrate lymphocyte til clonal manner anti reprogram type interferon response exhaustion gene program effector memory resident memory contrast anti activate expand pre existing til do not rejuvenate exhausted phenotype t effector cell anti not anti induce widespread tcr sharing different transcriptional state as well increase tcr diversity respond patient datum suggest doublet regimen specific transcriptional clonal dynamic tumor reactive t cell,"Li, Housaiyin,Zandberg, Dan P,Kulkarni, Aditi,Chiosea, Simion I,Santos, Patricia M,Isett, Brian R,Joy, Marion,Sica, Gabriel L,Contrera, Kevin J,Tatsuoka, Curtis M,Brand, Matthias,Duvvuri, Umamaheswar,Kim, Seungwon,Kubik, Mark,Sridharan, Shaum,Tu, Fei,Chen, Jie,Bruno, Tullia C,Vignali, Dario A A,Cillo, Anthony R,Bao, Riyue,Wang, Jing Hong,Vujanovic, Lazar,Ferris, Robert L",06/03/2024,Cancer cell
10.1016/j.ccell.2025.02.026,distinct t cell dynamic associate response neoadjuvant cancer immunotherapy,leverage clinical trial compare neoadjuvant anti anti anti therapy head neck squamous cell carcinoma patient combination therapy promote high pathologic response rate monotherapy major pathologic response be associate well survival to address successful immune checkpoint inhibitor ici regimen act similar distinct pathway robustly longitudinally characterize transcriptional proteomic dynamic tumor infiltrate lymphocyte til clonal manner anti reprogram type interferon response exhaustion gene program effector memory resident memory contrast anti activate expand pre existing til do not rejuvenate exhausted phenotype t effector cell anti not anti induce widespread tcr sharing different transcriptional state as well increase tcr diversity respond patient datum suggest doublet regimen specific transcriptional clonal dynamic tumor reactive t cell,"Li, Housaiyin,Zandberg, Dan P,Kulkarni, Aditi,Chiosea, Simion I,Santos, Patricia M,Isett, Brian R,Joy, Marion,Sica, Gabriel L,Contrera, Kevin J,Tatsuoka, Curtis M,Brand, Matthias,Duvvuri, Umamaheswar,Kim, Seungwon,Kubik, Mark,Sridharan, Shaum,Tu, Fei,Chen, Jie,Bruno, Tullia C,Vignali, Dario A A,Cillo, Anthony R,Bao, Riyue,Wang, Jing Hong,Vujanovic, Lazar,Ferris, Robert L",06/03/2024,Cancer cell
10.1001/jama.2025.0220,chronic myeloid leukemia review,importance chronic myeloid leukemia cml have annual incidence case people be newly diagnose approximately individual year us approximately people us million worldwide have cml observation chronic myeloid leukemia be myeloproliferative neoplasm characterize presence philadelphia chromosome be define oncogene develop fusion proto oncogene constitutively active bcr gene approximately people cml present indolent chronic phase cml define blast less blood bone marrow absence extramedullary evidence leukemia basophil less platelet count to most advanced stage be cml blastic phase cml bp characterize world health organization more blast immature cell md anderson cancer center european leukemianet more approximately to patient cml present cml bp first generation tyrosine kinase inhibitor tkis target such imatinib second generation tkis such bosutinib dasatinib nilotinib have improve cml relate mortality to year to year such patient cml have survival rate similar general age match population six tki have be approve us food drug administration include be first line treatment imatinib dasatinib bosutinib nilotinib asciminib approve treatment disease progression initial therapy dasatinib bosutinib nilotinib ponatinib asciminib effect improved survival be similar tki more patient be able to promptly achieve maintain clearance third generation tkis medication adherence be important to maintain treatment responsiveness tki be associate hematologic toxicity such myelosuppression additional agent specific adverse effect such pleural effusion dasatinib arterio occlusive event such myocardial infarction stroke peripheral artery disease nilotinib ponatinib gastrointestinal disturbance bosutinib increase amylase lipase pancreatitis ponatinib asciminib nilotinib adverse effect should be consider select tki allogeneic hematopoietic stem cell transplant be reasonably safe therapy cure rate range to base stage cml time transplant stem cell transplant be reserve patient cml do not respond second generation tkis intolerance multiple tki accelerate phase cml cml bp conclusion relevance chronic myeloid leukemia be myeloproliferative neoplasm can typically be effectively treat improve survival similar general age match population many patient require continuous tki therapy therefore tki therapy should be select consideration adverse effect patient should be help to maximize adherence tki treatment,"Jabbour, Elias,Kantarjian, Hagop",17/03/2025,JAMA
10.1038/s43018-025-00932-3,engineer bacteria near infrared light inducible expression cancer therapeutic,bacteria base therapy hold great promise cancer treatment selective tumor colonization proliferation however clinical application be hinder need safe precise control system to regulate local therapeutic payload expression release here develop near infrared nir light mediate padc base photoswitch netmap system base chimeric phytochrome activate diguanylyl cyclase padc cyclic diguanylate monophosphate dependent transcriptional activator mrkh netmap engineer bacteria exhibit antitumor performance mouse tumor model different level immunogenicity specifically immunogenic lymphoma tumor nir induce pd nanobodie enhance activation adaptive immunity low immunogenic tumor include mouse derive colon cancer model orthotopic human breast cancer cell line derive xenograft model colorectal cancer patient derive xenograft model nir induce azurin cytolysin predominantly lead tumor inhibition study identify nir light mediate therapeutic platform engineer bacteria base therapy customizable output precise dosage control,"Qiao, Longliang,Niu, Lingxue,Wang, Zhihao,Deng, Zhenqiang,Di, Dai,Ma, Xiaoding,Zhou, Yang,Kong, Deqiang,Wang, Qilin,Yin, Jianli,Jin, Lingli,Sun, Jing,Feng, Bo,Lu, Weiqiang,Cai, Fengfeng,Guan, Ningzi,Ye, Haifeng",18/12/2023,Nature cancer
10.1002/advs.202414985,mitofusin drive preimplantation development enhance chromatin incorporation histone,mitofusin play crucial role mitochondrial fusion oocyte development however function preimplantation embryonic development potential involvement epigenetic regulation remain poorly understand study be show interact key component cytoplasmic lattice oocyte early embryo deficiency mice result reduce level decrease expression translational machinery component suppress protein synthesis activity low histone abundance disruption lead failure male pronucleus formation aberrant zygotic genome activation impaired embryonic development be far demonstrate activator promote incorporation rescue early development maternally aged embryo low level additionally positive correlation protein level early human embryo be observe together finding provide new insight role regulate epigenetic reprogramme preimplantation embryo development,"Shi, Xiao-Yan,Tian, Yu,Wang, Yu-Fan,Zhang, Yi-Ran,Yin, Ying,Tian, Qing,Li, Lei,Ma, Bing-Xin,He, Ximiao,Zhou, Li-Quan",07/02/2025,"Advanced science (Weinheim, Baden-Wurttemberg, Germany)"
10.1001/jamanetworkopen.2025.0648,mizoribine cyclophosphamide lupus nephritis randomized clinical trial,importance lupus nephritis be typically treat intravenous cyclophosphamide be associate serious adverse effect oral mizoribine may be alternative induction therapy lupus nephritis however large scale long term randomize clinical study mizoribine be lack objective to assess efficacy safety oral mizoribine intravenous cyclophosphamide induction therapy chinese patient lupus nephritis design setting participant prospective multicenter parallel group open label phase randomize clinical trial recruit patient class iii iv lupus nephritis age to year center china inclusion criterion include hour urinary protein level g high systemic lupus erythematosus disease activity index high first patient be enrol november study finish march follow period be week datum be analyze september january intervention oral mizoribine mg time day cyclophosphamide intravenous dose g body surface area maximum dose g d week oral glucocorticoid main outcome measure total remission rate complete remission rate partial remission rate week prespecifie result total patient be randomize patient mean sd age year woman be treat patient mizoribine group patient cyclophosphamide group total remission rate week be patient mizoribine group patient cyclophosphamide group relative risk ratio mizoribine cyclophosphamide be ci low limit side ci be great noninferiority margin indicate mizoribine be noninferior to cyclophosphamide change other immune parameter kidney function be generally similar group incidence treatment relate treatment emergent adverse event be patient mizoribine group patient cyclophosphamide group most frequent adverse event group be upper respiratory tract infection patient patient respectively conclusion relevance randomize clinical trial show compare intravenous cyclophosphamide oral mizoribine be noninferior well tolerate use glucocorticoid induction therapy active lupus nephritis mizoribine can be use alternative intravenous cyclophosphamide induction therapy lupus nephritis trial registration identifi,"Dong, Zheyi,Luo, Ping,Sun, Shiren,Ni, Zhaohui,He, Yani,Huang, Xiangyang,Liu, Zhangsuo,Wu, Zhenbiao,Zhang, Xinzhou,Liao, Yunhua,Zhao, Jianhong,Lin, Hongli,Zhang, Xiao,Fu, Rongguo,Ding, Guohua,Xu, Yan,Wang, Lihua,Xiao, Yuefei,Shi, Shumei,Zuo, Xiaoxia,Li, Zhanguo,Qiao, Li,Wang, Rong,Li, Wenge,Wan, Jianxin,Li, Ying,Guan, Tianjun,Deng, Xiaoli,Wu, Xiaoyan,Zheng, Hongguang,Chen, Jianghua,He, Lan,Yamaguchi, Seika,Wang, Hua,Cai, Guang-Yan,Zhang, Li,Chen, Xiangmei",14/03/2025,JAMA network open
10.1038/s42255-025-01254-5,cyclic metabolic switching theory intermittent fasting,intermittent fasting ketogenic diet kds have recently attract much attention scientific literature popular culture follow long history exercise caloric restriction cr research involve cyclic metabolic switching cms ketogenic non ketogenic state kds cr may not perspective postulate beneficial effect result alternate activation adaptive cellular stress response pathway fast period follow cell growth plasticity pathway feeding period thereby establish cyclic metabolic switching cms theory health benefit may go see continuous cr kds cms owe unique interplay signal function ketone β hydroxybutyrate mitochondrial adaptation reciprocal activation autophagy mtor pathway endocrine paracrine signalling gut microbiota circadian biology cms theory may have important implication future basic research clinical trial development pharmacological intervention healthy lifestyle practice,"Mattson, Mark P",25/09/2024,Nature metabolism
10.1038/s44161-025-00622-4,maternal high fat diet exacerbate atherosclerosis development offspring epigenetic memory,maternal exposure western type diet wd increase susceptibility adult offspring to atherosclerosis partly fetal endothelial cell ecs become dysfunctional inflame due risk factor transmit maternal fetal blood exchange however underlie mechanism remain unclear here show maternal wd accelerate atherogenesis adult offspring mouse regulate chromatin dynamic activator aortic ec induce inflammatory memory chromatin level find hydroxycholesterol be involve memory establishment also act secondary stimulator amplify expression inflammatory factor enhance enrichment ecs inhibit bind chromatin reduce inflammatory response human umbilical vein ec mother hypercholesterolemia decrease atherogenesis offspring mouse expose maternal wd finding demonstrate maternal wd exacerbate ec dysfunction atherosclerosis adult offspring induce associate epigenetic memory increase chromatin accessibility inflammatory gene,"Li, Kan,Qian, Weiqi,Zhang, Fangni,Zhang, Wenhui,Lv, Huizhen,Quan, Meixi,Sun, Weiyan,Liu, Ruixin,Cao, Xinyi,Xian, Zhong,Bao, Suya,Jiang, Hongfeng,Du, Jie,Zhang, Meng,Chen, Yupeng,Zhang, Jian,Han, Cha,Ai, Ding",04/07/2024,Nature cardiovascular research
10.1053/j.gastro.2025.02.032,evolution esophageal adenocarcinoma precursor lesion stem cell,background aim metastatic cancer arise decade long succession increasingly virulent precursor lesion represent prospective target therapeutic intervention evolutionary process have be particularly vivid esophageal adenocarcinoma eac cancer associated precursor lesion include barrett esophagus be low grade dysplasia lgd high grade dysplasia hgd co exist accessible two dimensional pattern esophageal mucosa give durability precursor lesion be likely eac rely stem cell regenerative growth to assess role stem cell evolution eac apply technology selectively clone stem cell gastrointestinal tract patient match endoscopic biopsy precursor lesion implicate eac method histologically validate endoscopic biopsy series include eac hgd lgd be normal esophageal mucosa be obtain patient present eac rare cell lesion prove clonogenic be assess vitro differentiation tumorigenicity mouse molecular genetic result lesion evolution eac possess discrete set clonogenic cell mark immaturity enormous proliferative potential lesion specific differentiation fate dna sequence clone reveal intralesional heterogeneity clonal resolution mutation progression give patient be lgd hgd eac high throughput chemical screen against be stem cell reveal drug combination be similarly effective stem cell ldg hgd eac conclusion lesion evolution eac possess discrete population stem cell be potential therapeutic target,"Xian, Wa,Wang, Shan,Xie, Jingzhong,Yamamoto, Yusuke,Khorrami, Melina,Zhang, Yanting,Montes, Raul Caballero,Desales, Caycel,Khorrami, Melika,Mory, Zaal,Hoffman, Ashley,Su, Amber,Nguyen, Crystal,Davies, Peter J A,Stephan, Clifford,Pan, Shuang,Wu, Wengen,Liu, Yuxin,Siegelman, Jeremy,Waters, Rebecca E,Ross, William A,Song, Shumei,Metersky, Mark,Beer, David G,Crum, Christopher P,Stewart, Alexander J,Vincent, Matthew,Russell, Richard,Izard, Robert A,Ho, Khek Yu,Lai, Jack Hung-Sen,Bachovchin, William W,Ajani, Jaffer A,McKeon, Frank D",07/11/2024,Gastroenterology
10.1016/j.phymed.2025.156628,effective compound jinshui huanxian formula act src inhibitor to inhibit mediate lactation improve pulmonary fibrosis,background active ingredient composition jinshui huanxian formula ecc jhf consist five active ingredient icariin isoliquiritigenin nobiletin peimine paeoniflorin demonstrate notable therapeutic effect pulmonary fibrosis purpose inhibition glycolysis have be demonstrate to be effective treat experimental idiopathic pulmonary fibrosis ipf research seek to explore impact aerobic glycolysis mitigation pulmonary fibrosis ecc jhf method pulmonary fibrosis mouse model be generate administration bleomycin bleomycin degree pulmonary fibrosis be analyze hematoxylin eosin stain as well masson trichrome stain western blot wb immunofluorescence real time quantitative pcr q pcr assay fibroblast activation marker glycolysis relate gene lung tissue lactic acid la content assay kit be employ to quantify lactate concentration lung tissue fibroblast culture immunoprecipitation ip be apply to detect lactylate modify protein level mass spectrometry ms be use to analyze lactate substrate profile fibroblast wb be employ to detect lactate modification level histone target ecc jhf be analyze use network pharmacology molecular docking cellular enthusiasm transfer analysis cetsa examine binding ecc jhf src influence ecc jhf src activation be assess use wb src small interfere rna sisrc be design transfecte cell to validate function src inhibition fibroblast activation ecc jhf result blm induce pulmonary fibrosis mouse ecc jhf significantly reduce alveolar inflammation collagen deposition lung tissue fibroblast ecc jhf notably inhibit expression lactate level lactylate modifying protein ms wb analysis show ecc jhf significantly reduce level network pharmacology analysis molecular docking cetsa result indicate src serve key target ecc jhf sisrc effectively mitigate impact ecc jhf expression level activation fibroblast conclusion ecc jhf may improve pulmonary fibrosis inhibit src activation block mediate lactate production down regulate level inhibit fibroblast activation result serve significant reference advancement ecc jhf exploration ipf,"Zheng, Jiaping,Du, Yan,Shao, Wenbo,Li, Jiansheng,Zhao, Peng,Zhang, Qin",04/09/2024,Phytomedicine : international journal of phytotherapy and phytopharmacology
10.1038/s41413-025-00413-4,axis prevent osteoarthritis mitochondrial renewal metabolic switch,maintain mitochondrial homeostasis be critical preserve chondrocyte physiological condition increase resistance osteoarthritis oa however underlie mechanism govern mitochondrial self renewal energy production remain elusive study demonstrate mitochondrial damage aberrant mitophagy oa chondrocyte genetically overexpresse pten induce putative kinase protect cartilage degeneration remove defective mitochondria knockout aggravate cartilage damage impaired mitophagy directly deacetylate to promote mitophagy cartilage anabolism specifically phosphorylate site preserve active tetrameric form inhibit nuclear translocation interaction β catenin result metabolic shift increase energy production finally double knockout mouse model demonstrate role axis safeguard structural integrity articular joint improve motor function overall study provide novel insight regulation mitochondrial renewal metabolic switch oa,"Deng, Yaoge,Hou, Mingzhuang,Wu, Yubin,Liu, Yang,Xia, Xiaowei,Yu, Chenqi,Yu, Jianfeng,Yang, Huilin,Zhang, Yijian,Zhu, Xuesong",19/08/2024,Bone research
10.1210/clinem/dgaf174,role regulation intramuscular sex hormone skeletal muscle systematic review,introduction serum concentration androgen oestrogen main male female sex hormone respectively naturally fluctuate lifespan sex hormone be mainly produce gonad evidence suggest can also be locally synthesise skeletal muscle however little be know purpose intramuscular sex hormone role skeletal muscle systematic review aim to investigate intramuscular sex hormone concentration vary lifespan exercise affect intramuscular sex hormone concentration intramuscular sex hormone be associate skeletal muscle mass function method four database be search study be include contain measurement intramuscular sex hormone healthy male female free hormonal treatment rodent result thirteen study be include intramuscular testosterone be reduce old male compare young counterpart comparison intramuscular sex hormone concentration post menopausal female yield inconclusive finding chronic exercise decrease androgen oestradiol female increase androgen male acute exercise do not change intramuscular hormone concentration human increase rodent intramuscular androgen be positively associate muscle mass strength male female conflicting finding be report oestradiol androgen measure muscle mass function conclusion current evidence suggest ageing exercise differentially modulate intramuscular sex hormone concentration association muscle mass function male female model system,"Engman, Viktor,Critchlow, Annabel J,Laakkonen, Eija K,Hansen, Mette,Mason, Shaun,Lamon, Séverine",28/10/2024,The Journal of clinical endocrinology and metabolism
10.1111/ceo.13695,cardiovascular effect safety mannitol treat raise intraocular pressure,,"Atik, Alp,Chan, Elsie,Crock, Carmel,Ang, Ghee S",24/11/2019,Clinical & experimental ophthalmology
