text,hate_speech
Quiero prisión revisable caso ser nacionalidad español ser extranjero importar ser Senegal Rusia querer año expulsión ir ya racismo xenofobia vinagre JUSTICIA PUTA vez tenéis harto,0
puto moro mierda pela mucho cartelito Leticia,1
siempre mayoría crimen machista cometer inmigrante cultura infinitamente más machista ser cierto,1
envir politono sonitono clave ayuda podrás salvar niño guineano coste llamada ser península,0
Andalucia destacar medida Integración persona origen migrante Málaga,0
marfileño declaración Barça TV mostrar feliz primero semana azulgrana recibida haber ser cálir,0
Kosovo narcoestado musulmán satélite otan Albania Albania haber hacer reemplazo étnico serbio Kosovo ayuda OTAN,0
ya ser dos no comprar producto catalán marroquí,0
URDA Spain estar impartir clase español persona refugiado ucraniano programa ser posible gracias iniciativa SantanderAyuda querer conocer más perfil persona refugiado ucraniano encontrar España,0
GTA VI tener protagonista mujer latino Jason Schreier,0
hablar película apellido vasco apellido catalán ahora provincia andaluz género comedia España no tener fin fin,0
Osolwo ser nuevo estrella despuntar fútbol Senegalés llamar Mane,0
igualmente pcr pedir migración independientemente viaje,0
ser ser churrero no implicar ser indocumentado creer bastante erróneo hacer comparación comunista liberal ser antitético,0
gana cuarto temporada salir señor español hablar dialecto hispanoamericano adorar nuevo avatar,0
no poder devolver irregularmente inmigrante llegar manera irregular no ser ser refugiado guerra,0
haber hacer voluntariado solicitante ámbito subsahariano doble vara motivo político cuestión asilo refugio ser triste realidad no saber referir realidad régimen cubano frente imagen idealizado,0
ir costar diez nonlo cumplir Marruecos,0
Xke ser retrógrado ponés many no mirar latino Iguales,1
Buenos días ser Titularesdeldía Plan ahorro energético noviembre cereal salir Ucrania aliviar crisis alimentario Africa Asia EEUU mata Ayman Zawahiri ser actual líder Qaeda,0
lunático ser Trump no poder tener botón rojo alcance hidepvta demócrata liar parda cn primavera árabe Ucrania cosa no ir cumplir ahora Taiwan,0
Subsaharianos pedo,1
colaborador donant hacer posible poder desarrollar proyecto dar beca educativo sanitaria niño joven mujer África Subsahariana Blanca Martí delegado Granada acción fundraising gracias vuestra colaboración,0
pagar moro vicio,0
DeMálaga Miss Málaga representar España certamen internacional Reina Hispanoamericana próximo otoño celebrar Bolivia,0
Combates naval gran Sitio Gibraltar,0
observatorio Español África subsaharián Guinea Ecuatorial Inout Viajes,0
Comunidad Madrid forzar migrant VIH buscar vía extraoficial obtener tratamiento través,0
Latino hack madre parir,0
niño marroquí venir sur no haber París Estardos Unidos caso ya venir kit refugiado derecho paga,1
Barcelona ya tener preparado nuevo contrato Koundé posterior solicitud rebaja sueldo mitad,0
Tened dignidad par cojón llamar cosa nombre gentuza llevar cabo práctica sumisión químico violar robar ser amplio mayoría argelino musulmán nacido Francia Welcome refugees no haber ser xenófobo,1
intervenida Línea falsificación vender feria localidad LaLínea,0
Spanish EEUU ser latino efecto práctico eres White no ser Spanish eres from Spain ser clasista ser ver,0
Córdoba Costa Marfil así ser trabajo cooperante enfermera Dori Muñoz país africano,0
Comunidad Madrid facturar asistencia Atención Primaria persona migrant vía,0
catolicismo España insultar religión musulmán maltratar mujer buen comunista seguir rito dar culo,0
setroi NOTICIAS certificado dictador G NOTICIAS régimen tunecino tener ahora carta naturaleza formalmente legal culminar elección próximo diciembre Said coronar construcción edif,0
Señor tertuliano ser tanto docto ser deber saber q guayabera nombrado Cuba extensión hispanoamérica llamar hacer año SAHARIANA claro jodar chiste cuñao verdad,0
Cataluña ser tema parecer ser francés moro haber niña estar desbarrar seguro,0
hecho nacer Costa Marfil pasar llevar Bilbao crío ejemplo ser octavo temporada Lezama,0
Gibraltar espaÑol,0
tema pintada HOz martillo casa árabe Marrakech,0
No exactamente creer Covadonga no existirio España tal conocer crónica árabe hablar Pelayo desviar columna hombre barbaridad controlar rebelión postre costar derrota,0
Ajjajaj crié barrio moro tener miedo no alrev mirar miedo crío año dai pena,0
no ser racista ver humillante ser africano latinoamericano democrat,0
emigrar no tener ser complicar importante más recomendable ser garantizar migración exitoso legalizado contar asesoría migratorio personalizado experto más año experiencia,0
vais manifestaro niña violado inmigrante ilegal niña Mallorca Valencia abusada centeo no importar Abrazos,1
joven guineano saludo,1
charla dar colegio zona rural estár explicar riesgo salud intrusión polvo sahariano llamar muchísimo atención niño año decir ser mucho bueno albercoqu vender bien,0
Boom latinoamericano historia característica autor obra valioso boom hispanoamericano,0
Cuba desangrar hacer tiempo deporte ser parte más sacrificio población atleta buscar mejor vida hacer africano USA país aceleran nacionalización salir existir derecho compensación Cuba,0
Antonio cabrear Argelia Rusia aumentar porcentaje suministro gas contar mejor condición pastar,0
supermercado quedar papel higiénico tener limpiar culo papel cocina,0
ciudadano Franceses procedencia Africana,0
cambio climático estar matar elefante africano ritmo vez mayor caza furtivo,0
no saber dejáis Rata Mora hacer daño compañera,0
Esparraguitos plancha papas fritas ternera salsa mora,0
cristiano veranear norte pq ser único sitio no ser conquistar moro Pregunta serio,0
Castilla León sufrir nuevo episodio polvo africano partir domingo Calima,0
Musulmana,0
matar moro ahora no ser kiko,1
Argelinos decir angelito,1
SIGUEN MENTIRAS HOY BLANCO mañana negro fiabilidad deber tener prensa muchos ENGAÑAN CRISIS DIPLOMÁTICA Argelia desautorizar patronal bancaria bloqueo comercial España juego SATANICOS calle,0
presidente Túnez Kais Saied ver aprobado Constitución hacer retroceder década marco legal país análisis Carta Magna fractura Túnez posible escenario,0
Mentira comprái gas ruso no enviáis prometisteis Ucrania no hablar abandono refugiado ucraniano,0
Maldita izquierda latinoamericano seguir vivo después haber fatigar infamia,0
culpa cagada gas Argelino chulo reproche Sois tarugo cuidado,0
no ser haber ser divorcio aborto anticonceptivo Tinder ser derecho no obligación impedir moza llevar vida Kika testigo Jehová musulmana wahabista,0
anillamiento ave ser esencial conocer movimiento migración especie estudiar longevidad recopilar dato científico estudio aamm anillan liberar cernícalo milano negro dos cigüeña Valonsadero Soria,0
Jajajajajajaja tener ni idea eres chiquillar gas Argelia cortar incidencia gasoducto ser reparar bastante rápido principal proveedor gas Europa ser Rusia ahora estar traer EEUU dólar haber igualar Euro bolsa,0
Despues decir imigrant encima realizar curso casa mañana mujer,0
dos primero parte libro parecer excelso mejor haber publicar Roma duda último diez año parte tercero cuarto tener pasaje decair transmitir visión africano,0
papel,0
indocumentado ser crédito ICO credibilidad gastáis dar mismo tal meter mierda Periodismo llamar tristeza,0
hablar África ser animal africano favorito,0
necesidad gente pagar impuesto necesidad inmigrante ilegal MENAS,1
García Lorca no ser tanto realismo mágico haber hacer daño literatura hispanoamericán gustar libro no poder perder entrevista publicar proxima semana LUZ palabra no dejar indiferente,0
hoy dos niña monísima haber alegrar tarde,0
Sigo ver mayoría delito ser extranjero Compara ahora hombre mujer ver ser mayoría no venir defender no haber discriminación no haber no poder decir mismo inmigración,0
cifra persona desplazado hogar ser millón motivo Día Personas Refugiadas realizar encuentro contribuir integración sociedad aprendizaje castellano,0
ir ser más antiguo hombre Dios Reino Aragón conquistar repoblar Reino musulmán Valencia,0
comunidad eclesial base Brasil presentar texto preparación Intereclesial texto seguir tradición latinoamericano tener método ver juzgar actuar Iglesia salida experiencia sinodalidad,0
no creer ser mucho objetivo hablándote música Rosalía siempre haber ser fan propuesta haber poner pata arriba música hispano latinoamericano primero día,0
información ser más inmigración tipo religión más delito mujer ser dato INE dato no gustar llámalo dato fascista lloro,1
Final Paris Moro Maca Raul,0
Paquita Rubio mujer cartel refugiado México retrato realizado marido estar Prado reportaje serie mujer España,0
Quina alegrio llegir teu tuit Hermanos ser poner poner poder España ser marroquí francés portugués no ser Aragón Catalunya hacer piña,0
hora vuelo base Agoncillo junio mantener Bamako Mali apoyo FAMET,0
Sabías Tokyo ser gran metropoli aire más limpio mundo compi curro senegalesa hacer allí doctorado ambiental ser título tesis único país cumplir protocolo Kyoto acuerdo París,0
vecino creer no tener claro lucha racismo estar mucho equivocado adoptar niña subsaharián nombre Blanca,0
veces también decir Vosotros sois cristianos ser musulmán budista tanto ambos ser creyent tener creer tu Dios ser mejor mio decir decir ser único verdadero también decir,0
Dijeron reconquistarir estar España ley inmigración haber abrazar inmigrante necesitar no par tener hijo país pensar acogeremo okupa trabajo paga Seg Social economía aguantar,1
llamar tendencia parecer ser indocumentado menos mal mayoría gente no ser idiota,0
no hacer indocumentado así vai,0
Tiradores senegalés cuerpo infantería luchar Francia guerra historia olvidar,0
estar explorar VPN tv latinoamericano,0
Canada alertar ciudadano sugerir no viajar Marruecos escalada Sáhara Occidental más INFO,0
silla desfile Moros Cristianos poder adquirir viernes Plaza baix,0
Puedo mirarte vez nunca aburriré ser perfección hecho mujer eres preciosa Mali cabeza pie,0
sentir no ser así latino EUROPEOS ser muuucho antes latino latinoamericano quiera no no ser problema no no querer ser latinoamericano no estar moda estar más moda hacer año querer ser latinoamericano ahora,0
venir más pobre escapar guerra ser milonga venir tener dinero varón mayor parte no haber tener más dos dedo frente comparar imagen refugiado ucraniano mujer niño,0
criticar haber decir no preocupar más mínimo pasar chica no musulmán encima tweet no teniar ver chica musulmán mujer general ser musulmana no,0
punto Rojo largo transición haber comenzar Diálogo acertado Monereo realidad geopolítico mundo nuevo iniciado guerra Ucrania sumar ahora Serbia OTAN Kosovo Mar China Sahel OTAN Argelia Mali,0
Llueve esperar hayar refugiado gota ser litro,0
Senegal verdad,0
tanto citar embaucador apuesta junto Riqui Puig cárcel luego ir dar lección tipo carrer indocumentado,0
haber grupo argelino gentuza estar llenar calle,1
latino ser minoría ahora pensar ser grande continente latinoamericano luego hablar,0
no crear mitad decir indocumentado Gisbert,0
aquí línea trabajo principal reto panorama cultural actual igualdad Urgencia Climática Migraciones Decolonialismo museo común identidad no binaria Fan,0
decir ser nómada digital haber aparecer pasar España sbtodo isla encarecen no perder decir solución ser regular suelo derecho residente no inmigración,0
aprobar reforma problema migrant enfrentar encontrar trabajo regularizar situación no estar solucionado todavía quedar saber ir aplicar tipo acceso dar Mercado laboral,0
estar tender balcón tranquilamente escuchar vecino tener canto musulmán rezar haber quedar empanado sonidillo fondo repente cortar escuchar anuncio YouTube seguro coche haber dar,0
Opinión Abdou senegalés abrazo voluntaria Cruz Roja volver viral ser devolver irregularmente Marruecos España Comisión Española Ayuda Refugiado Estrella Galán,0
inmigrante entrar Pedro Sanchez EXISTE GOBIERNO NOS CORTAN GÁS enviar mil ARGELINOS ya mafia situado punto España ALMERIA ya tiemblo estar suceder hechos avisado VOX nivel precario español,1
tan solo par minuto después pasar allí ver Samuel tirado suelo inconsciente probablemente muerto llamar terriblemente atención ser estar lleno gente no movió dedo solo dos inmigrante ahora ciudadano español,0
poder ser más gilifacha fascistoide village peoplir Indocumentado flojo fin,0
bueno luego decir no ser persona abierto acercándomar cultura árabe ir meter pecho espalda,0
Falta chu Mirex instituto migración,0
foto archivo ver creer famoso nube levante Gibraltar parecer haber tener Levante sinfín verano ahora llevar levante poniente,0
Tampoco comunidad musulmán cristiana apenas mezclar no casar habitualmente así no haber sangre árabe general español importar tema genética,0
agente detener cinco joven presunto autor robo violencia agresión sexual hurto detenido tener año ser origen marroquí argelino,0
aquí leer cosa ser flipar bien tener experiencia combate ser ocupación territorio plagado musulmán capacidad lucha exterminio inserción campo concentración sabiondo WikiLeaks,0
peñón gibraltar xd estar habitado gente Galar,0
Bajada pantalón régimen militar argelino,0
indocumentado pedir fichaje merca invierno dirigente ahora ver mal forma plan B acceder dinero hacer posible fichaje dicho haber más botellín,0
novia ser Urales significar status refugiada,0
aparte ser tipo inmigración querer España tener razón casa Gente sepa ser comunismo no dejar comprar subvención español ser diferente aguantamos límite salir calle alzamiento,0
abrumador trabajo reconstrucción esperar ucraniano este Galyna Kios vivir refugiado familia vecino sombrío sótano cocinar improvisado estufa leña soldado ruso invadir puebl,0
Abde extremo marroquí d contrato tener sitio equipo pese buena actuación Koeman utilizar Barça buscar salida Girona querer cedido Villarreal pagario M Betis haber expresar predisposición,0
Marruecos solo venir mierda,1
Bienestar Social activar servicio atención integral familia ucraniano refugiado ElCampello Lee AQUÍ completar noticia,0
costar admitir haber cargar querer bueno ser decir hombre tener trabajar mujer casa ser cosa decir latina bailar genial ser polla ser graciosísimo vergonzoso dnigrant,0
día celebrar Fiestas San Cayetano San Lorenzo Virgen Paloma mostramos cartel realizado ImprentaMunicipal fiesta realizar versión castellano árabe chino conservar MuseoHistoriaMadrid,0
ser así mal también decir izquierda no ver puto pelo violación parte marroquí argelino no ser poca imagino caso rezar poner cirio español deseáis fuerza ser vuestro día distrute,1
detenido joven agredir sexualmente manada menor Valencia detenido tener año ser origen marroquí argelino joven tener antecedente policial encontrar situación irregular España,1
ser auténtico indocumentado inepto arte saqueo manejar maravilla,0
ver amiga no musulmán hijab ver quedar ser mas cuchi planeta,0
Leyendas africano cuento mito popular mitología africano moraleja niño adulto,0
propuesta Foro Integración Social Inmigrantes ser incluir reforma Reglamento Extranjería Peticiones reiterado organizado persona migrant refugiada reunir entregar informe,0
no teneis vergüenza acoso mediático contenido prueba papel gustar em fin menos credibilidad ya no poder tener así creer estar hacer especie parodia nacional,0
monopolio industria carne crianza intensivo Ecuador región latinoamericano Mexico IFC,0
Yarmouk Siria Sabías refugiado refugiada Palestina ser obligar abandonar campamento Yarmouk punto álgido conflicto sirio haber regresar familia,0
Programa Bridge Year tener fin ayudar estudiante comunidad universitario refugiado sistema universitario español más información,0
verdad ser ser producto español conformar tener tener cuidado ser no dar verdura África sudamerico allí no tener control sanidad haber España,0
Africanas líder construyar futuro continente vía k,0
Correcto Alejo enhorabuena Biden CIA hacer tiempo comentar musulmán mucho radical haber matar Bin Laden contestación ser saludo,0
cuestión ser medida brote viruela simio expandir estar ofrecer virus oportunidad precedente especie no africano virusypandemia,0
estar acuerdo tener haber más ayuda no haber reprochárselo refugiado guerra,0
saber canario Palmas votante PSOE tener senegalés representante Congreso Diputados,0
idioma Papúa Nueva Guinea representar idioma mundo embargo mayoría idioma contar menos hablant media Papúa Nueva Guinea tener idioma habitante,0
español mucho español violar INMIGRANTE haber pasar,0
GIBRALTAR ESPAÑOL,0
vallenato ser paté cultura latinoamericano no sabio origen ballenato originar guajira tierra antes pertenecer Venezuela laudo corrupto ahora ser colombiano estar Serca ser venezolano,0
ser jequ arab asi M minimo,0
mucho buen comparación América latino patio atrás Lugar desmán imperialista vs Rusia Europa Este Asia zona seguridad nacional ser tanto importante no estar claramente sometido,0
hoy hablarer gótico latinoamericano Núria Bendicho Jack Ketchum entrevistarer Layla Martínez desvelarer secreto Tavares ahí ser,0
vendo entrada platino puro latino puerto Santa Maria tres día,0
Bus Benidorm Talavera Torrijos Toledo Madridejos sábado Precio ida vuelta Solo ida vuelta sábado,0
Mohamed VI instar Argelia encontrar salida crisis Marruecos,0
JAJAJA MEO amador claro factura recordar cobrabar dejabas pagar llevabas detrás ser denasiar fría no impostor Documental documento Documierdal,0
ser tradición versión cristiano dulce musulmán manteca cerdo,0
saber ser inmigrante,0
penar retraso mental ser imigrante vivo país opinar políticamente no an preguntar ir país ser víctima feriado bancario Alondra no agar caso jente resentido,0
amaestrado Soros teoría globalista etiquetar racista verbalizas debacle meterno mejor Africa delincuente mantero Mbaye senegalés llegar montar sindicato mantero actividad ilegal hoy poner verde español diputado jajo seguir,0
vosotro no tenéis papel vosotro sois panda indocumentado mierda basura vergüenza periodismo,1
estar hablar mujer racializado papel limpia casa,0
Habria ver tener papel tmb igual lindo amiga madre tirar sudacar,1
Akapo no quedar nada mejor no haber crecer hispano guineano ser Cádiz ser auténtico pepino jugador ser fichajazo llevar siguiéndolo fichar Huracán fenómeno,0
hacer día presentábamos totebag hoy mostrar propuesta mucho africano pequ puzzle dominar jugar aprender cuenta verano parecer tres punto venta VeranoAfricano merchandising,0
pesaito haber dao africano,0
adolescente poder incapaz mantener conversación tema más importante mirar permanentemente teléfono así describir Deleón Bukele dos día antes elección ser parte equipo legal mandatario salvadoreño,0
RecomiendoLeer ÁFRICA elefante SED NEGRA historia más pobre pobre África elefante AMARILLOS Colección relato poema lleno magia sentimiento,0
diferencia cultural tampoco dejar ver matiz vecino agrupar saco marroquí pakistaní saharauis egipcio senegalés argelino árabe turco intentar aprender leer feminismo país musulmán,0
Guinea Ecuatorial iniciativa Agua Limpia Salesian Missions llevar agua fresco parroquia salesián Beayop,0
haber Tierra no ser inmigrante,0
Anda mirar llevar decir ultraderecha aparecer VOX gracias haber aumentar agresión gente coletivo gente inmigrante gracias discurso eñañoles haber hacer noooooo ahora mascad tragad ser solo muñequito,0
línea imaginario llamar frontera levantar muro no solo afectar desplazamiento ser humano también especie salvaje ser barrera más poderoso accidente geográfico,0
Araski reforzar juego interior senegalesa Maimouna Diarra jugadora tener experiencia WNBA jugar final Ángeles Sparks,0
servir democracia país ser pobre,0
ser shakirir bro pensar ser USA ahí haber mucho latinoamericano fan shakira también no latinoamericano deber no crear ser fútbol,0
mejor chaquetar corbata mas hispanoamericán,0
estar poner ciego mora AsíMeCague,0
migración masivo hablar nunca existir periodo Chavez migración estar nivel país entorno migrar colombiano ecuatoriano peruano solo haber ver registro españa ser refugiado no hablar millón,0
haber indocumentado creer,0
Argelia descongelar cuenta comercio exterior España Enviado,0
miedo puro latino ahora deved,0
estar contar poder encontrar televisión continental latinoamericano TeleSur dato dato día día hora día directo,0
NUEVA afán resistencia creación material gráfico artístico protestar reivindicar buscar ser querer recordar recorrer geografía latinoamericano Sol Acuña exposición Giro Gráfico Reina Sofía,0
Mucho Super guerrero español latino decis saiyajin español estar mal dicho Jin ser gentilicio japonés respetar tenei incoherencia ya gentilicio idioma Humano terricola ano español jin japonés,0
más indocumentado caer bulo,0
Bandas latino hacer botellón zona deportivo destrozar mobiliario urbano grafitis verguenza valencia capitaldelabasura,0
Refugiada portal batido coco llover aguachirri sartén sucio verano tropical banán calypso,0
así mismo acá hacer más latinoamericana,0
ladrón ser origen marroqui,1
Hola Quinta Molinos llevar cerrado día cartelito alegar ser condición meteorológico adverso haber perder huracán día estar refugiado aire condicionado casa,0
marroquíes argelino,1
más ola calor también ahogo África incendio Marruecos Túnez aumento temperatura continente provocar escasez alimento nuevo conflicto destrucción fauna glaciar africano,0
UE calificar escaso participación referéndum tunecino refrendar nuevo Constitución país poner expectativa próximo elección parlamentario país constituir oportunidad fomentar verdadero cambio,0
más étnico ser cultural religioso blanco poder ser no ser cristiano musulmán no ser jamás,0
Informan Lorca incremento nivel partícula alto temperatura intrusión aire sahariano,0
más inmigrante esperar tres barco humanitario Mediterráneo,0
americano haber dejar arma ejército país musulmán linde China zona China musulmán,0
indio musulmán religión haber cuanta deber hacer gracia,0
Supremo Gibraltar condenar diputado VOX Agustín Rosety presencia juicio,0
descubrir casco antiguo pueblo origen árabe Vilafamés ser pueblo interior provincia Castellón distancia Capital medida ir llegar V M,0
Doña insultar constitucionalista importar hacer inmigrante ofender,0
ya pasar país quedar futuro corazón documento plata trabajo amor propio seguridad sentimiento ánimo coraje ser mejor no haber mal mucho bien no venir bienvenido realidad,0
Mezquino comparar inmigración ilegal terrorismo confundir polarizar sentimiento deber ser responsable información dar ser sugerir hilo ser opinión tanto bonito bella pensar hilo,0
ser mujer menor Libia ser considerar país no seguro Denuncia Organización Internacional Migraciones IOM,0
Curioso decir Francia nación nutrar africano caso ser nacer criar Francia caso Iñaki sí destacar parte haber gente tal provocar incendiar generar polémica hacer ser mejor pasar,0
más kiko Jiménez menos rata mora favor,0
gibraltareño Jack Prior CAMPEÓN MUNDIAL remo GranBretaña Medalla oro Campeonato Mundial Varese Italia momento orgullo nacional TODOS Gibraltar afrontar tiempo difícil,0
haber solución requerir mas tiempo ser ir morir charo generación mas antiguo basicamente ser enfermo mental analfabeto creyent Lourdes regeneración costar proxima generación ser moro ahi tener voto poder,0
no ser más tonto ya no ws posible indocumentado,0
sentir mucho emocionadxs haber poder conversar país tener retina idea tener mejorar colectivo ir trabajar construir población migrante ColombiaRenace,0
Cierto más parecer selección Senegal xd,0
país más contagio mundo ser más probable encontrar continente africano,0
haber ser guineano,1
gente aquí no querer trabajo echar más hora reloj salario cotización miseria apañar Ley Extranjería hacer migrant papel no ir quedar aceptarlo,0
ver muchísimo gusto MALI TWIST bonito película retratir momento histórico país través vida dos joven enamorado ser delicado cercano valor bonito pesar hecho hermoso,0
no ser Mezquita no tener tanto claro mausoleo descansar familia real marroquí deber tener pequeño connotación religioso haber foto viaje ir velo,0
idea ajskskaja flyyn down sonar carrilero potencial championship nayef dar vib pivote defensivo argelino ligue,0
tener común puerta Valnadú Madrid torre Andador Nadador Albarracín ciudad marroquí Nador nombre venir árabe nādūr ناظور significar faro torre vigilancia,0
dejémono filosofía idealista mora no quisierear ser animal no ser querer ser mujer también ser sistema esclavitud musulmán ser manejar madre directamente,0
no avisar hotel haber manada moro ser peligroso,1
garantizar material no contener sustancia tóxico poder migrar alimento uso normal hacer ensayo migración,0
Guardia Civil interceptar embarcación marroquí detener patrón,0
DIRECTO patronal bancaria argelino volver autorizar operación España decisión junio haber bloquear contrato exportador español Informa,0
Eterravan jajajaj Griego más bien moro,0
k dar mas cringe vergüenza ajena ser español hablar latino ser gracioso,0
SANCHISIMO PROTEJE MARRUECOS no METAN mano HIBRIDO,0
peligro incendio EFFIS julio Peligro mucho extremo zona España Francia Italia Creta así Marruecos Túnez Argelia Peligro extremar previsto zona,0
origen histórico ser erai fenicio romano griego musulmán ya ser ser,0
poquito favor indígena igual tribu africano momento ya tener sistema lingüístico ser diferente conoz ser cosa palabra español venir lengua indígén aproximadamente lengua diferente,0
estar hablar castellano decir Latino Tate no Yuusha ya llevar año,0
