text,hate_speech
alabar actitud policia fascista criminal gobierno marroquí demostrado ser miserable SOCIALISTA sentir profundo vergüenza descansar paz ser humano asesinado,0
ver hombre veo mujer niño ser siempre refugiado guerra hombre quedar combatir,0
propósito prohibición burka prenda usado mujer musulmán domingo pasado ir playa Milanova Gestru Cataluña vi sra religión ropa toa vaín agua fría sol africano,1
poder ser más atrasado argentina ser mujer Chico ser sudacar educación,1
Menudo Zampaporras indocumentado,0
decir luc André diouf Dioh diputado socialista origen senegalés matanza inmigrante africano seguro haber compatriota manos policia beneplácito alabar actitud policía,0
Gatubela Catwoman Guason Joker así no fastidiser métete doblaj latino dejar castellano paz,0
Sumámonos tódala reivindicacións colectivo LGTBI tódalar persoas mundo poidar hoxe sempre Orgullo compartir publicación seguir entendendo contexto global actual,0
rector no recordar muerte padre Wilfredo Guinea ser director Buena Prensa ser secuestrar morir secuestrador,0
trabajar también persona refugiado mejorar nutrición salud mental cuidado básico seguridad alimentario huir principalmente violencia consecuencia crisis climático diamundialdelosrefugiado personasrefugiada refugiado,0
leeré no pasar Francia cierto haber más población argelino España africano marroquí argelino hacer año no ver matar francés vuestro ideario llegar dentro año seguir oir,0
opinión acercamiento Marruecos Israel no ser solo político también militar Nazanin Armanian,0
Aqui haber hablar poco ser Armas libia agitación maliense más cuarenta año Gadafi poder Libia adquirir enorme cantidad variedad arma,0
juego doblar inglés UK inglés EEUU no escuchar seguidor aquí vez pedir doblaje castellano cuenta latino tirar yugular no estar pedir no doble latino pedir doble castellano,0
ser justo revés latinoamericano venir latino Latino ser adjetivo provenir vocablo latinu referir ser natural pueblo hablar lengua derivado latín no ser tanto difícil hacer búsqueda internet,0
Todos Gerona llevar sirio marroquí argelino afgano,0
ilustrado Chávez izquierda latinoamericano no olvidir Zapatero ser pimpollo chavismo mina oro Venezuela incluido izquierdoso encantar vivir capitalista hablar socialismo pobreza igualitario,0
más racista africano no haber mundo ser ya haber aniquilar aquí España,1
Almeida no tener proyecto Madrid barrio igual conectavalleca dar trabajo hecho Latina PaseoVerdeLatina ser proyecto transformador convertir paseo sostenible mejorar vida vecindario,0
decir muerto fuente más parte Marruecos día hoy asalto violento Melilla mil gente documento ser consecuencia efecto llamado política equivocado UE Vienen saber ir quedar,1
Alcázar musulmán ciudad Valencia,0
derecho libertad estar limitar no poner bandera tendréis ir país árabe podrer conmemorar,0
rasta Trenzas africano ser horrible ser estéticamente feo negro poder dar pase blanco ser horrible,0
mujer estar acusado ser rompehogar defender,0
ya haber vía seguro ser entrar legalmente poder preferir pagar mafia vez viaje avión delincuente indocumentado asaltir frontera vuelta volver,1
unir CampBay encender pasión fauna marino ser primordial supervivencia experiencia despertar exactamente tener magnífico litoral merecer pena preservar futuro generación Gibraltar,0
niñata haber meter casa pandar gilili sois INDOCUMENTADOS,0
nigeriano ser primero nigeria senegalés Senegal haber trabajar familia construir país,0
Bueno dentro mali poder ser menos ser temporal ciscustancial no tanto peligroso ahora beber agua,0
sólo venir decir cada Gibraltareños jugar fútbol nivel profesional,0
decir dni no ser decia español estar morir campo argelia saber ser espacio aereo sahara occidental no ser marroqui poner dni,0
país latinoamericano terminar más año gobierno derecha,0
María hablar acento latino diferente simplemente repugnante grimar,1
buen noticia resto arqueológico mezquita funerario época musulmán fin ir poder ser visitar público ser proceso llevar tiempo trabajar Málaga tener mostrar patrimonio ser único,0
China no ser musulmán Rusia tampoco ser homofobar,0
no poder tapar sol dedo comunidad lgtbi existir escena ser último podría irte vivir país Medio Oriente África subsaharián homosexualidad estar prohibido,0
Seguro no haber botado,0
Auge extremo derecha ser nombre clave aumento población musulmán,0
Mejor coño manifestáis aquí haber ser policía español marroquí,0
Tu Dios ser judío Tu música ser negro Tu auto ser japonés Tu pizza ser italiano Tu gas ser argelino Tu café ser brasileño Tu democracia ser griego número ser árabe Tus letra ser latina ser vecino llamar extranjero Eduardo Galeano,0
Tienes moro gitano,1
estar año gobernar suponer no haber mestizaje no creer español tener genética marroquí tampoco polaco simplemente ser resultado mezcla pueblo poco tener ver tunecino alemán,0
Dios libre despreciar estar contra latinoamericano ser más tener familia colombiano ser mejor referente Dragon Ball ser más tóxico parir madre ya hacer tiempo aún recordar burlar hacer doblaje castellano,0
ser mora bien fresco verde amarillo venir,0
pederastia ser normal musulmán parecer esposo también tener denuncia Francia hacer cosa chulisima cuanta cabra cambiar padre,0
jornada formación haber ser posible gracias colaboración,0
desde luego tía ser gilipolla total no Psoe dejar salir público vez hablar indocumentado atrevido subir pan,0
Cuidado ranking situar Madrid séptimo ciudad peor calidad aire mundo nivel referir contexto puntual alto nivel polvo sahariano suspensión no tener relación tráfico industria,0
haber leer joven sudacar hhh,0
Pedro Sánchez calificar desorden público ataque integridad territorial España muerte subsahariano manos policía marroquí proximidad ciudad Melilla,0
vas vivir noruego cultura latinoamericano muyyyyyy distante puntera europeo,1
no vacunar Africanos seguir repoblado mundo color negro,1
primero asalto masivo Melilla fin crisis Marruecos subsahariano haber participar salto pesar fuerza país vecino haber intentar éxito frenar avalancha,0
Turquía tener democracia tanto pleno fiesta Orgullo estar prohibido democrático Túnez ir decir más Eva,0
amar cultura musulmán gente marroquí,0
no preocupar pagar parte proporcional cuenta cura Rey cambio querer meta par inmigrante casa no valer deber ser subsahariano haber saltar valla magrebí estar centro acogida,1
pregunta respuesta viajar Costa Marfil,0
Racismo ser hacer violación sistemático mujer europeo ser blanco no problema delito motivo racista cultural recibir europeo,0
argumento esgrimir indocumentada Moreno Bonilla haber ganar gracias recurso económico Gobierno central mandar Andalucía paliar pandemia ser analfabeto saber hablar analfabeto también no quedar analfabeto Andalucía,0
hoy Santo Tomás Moro mártir querer felicitar político tuitline inspire llevar camino recto,0
Argelia movilizar tropa macroejercicio pleno crisis España tener fe patria requerir acción terreno no sólo palabra incidir máximo representante Fuerzas Armadas argelino contar,0
repulsión ser directamente odio africano ser tremendo descubrir capaz mafia apestós solito miedo entrar bestia ir crecer dentro,1
vez estar acuerdo Pedro Sánchez policía Marruecos actuación frontera Melilla haber parar invasión bien resuelto,0
más dos millón refugiado necesitar ser reasentar tercero país,0
Senegal ens robar luego faltar pasta ya poner ridículo psicópato pernoctar Moncloa,0
sicario año Madrid nuevo peligroso estrategia cabecilla banda latino través,0
supervisor AméricaLatina acceder formación ofrecido Seguros Actuarios,0
Soñé poner trenza africano ver bien,0
tanto ser así organización criminal llamado PP imputado indocumentado Bonilla dinero Barcenas bolsillo haber dar mayoría absoluto,0
sí moro invadar canarias ir hacer,1
motivo feminazi no mover dedo fulano cuestión ser sudaka quedar claro chusma comunista ayuda importación delincuente extranjero cargo espalda varón español fuerachiringuitos GobiernoDimisión TeamVox,1
ser blanco rubio huy guerra refugiado puerta abierto ser negro huy guerra pobreza zozobraer invasor garrote ser diferencia,0
Países musulmán financiar vuestra casa madre Podemos cosa defender Islam ser gayfriendly vez no poder estar,0
Indocumentado tener aquí colgado,0
Literatura latinoamericano ser característica autor mejor novela cuento narrativa latinoamericano M,0
Solidaridad Aqila Hashimi alpinistar afgán refugiado,0
río suena agua llevar,0
más persona subsahariana intentar asaltar violentamente ciudad Melilla Marruecos desplegar agente Policía aún así conseguir entrar ciudad luego venir nazi fascista español decir no Marruecos sois peor,0
creer equivoca no población argelino zoquete,0
dar pena asco refugiado marroquí ucraniano ser igual ser persona joder decir ser no racista ser mentiroso no ser blanco ojo azul no ser,0
no defeir ser esclavo atraer senegalés vivirás senegal ves pasar Francia Suecia disfrutar no quedar estar igual aquí,1
Tiradores senegalés cuerpo infantería luchar Francia guerra historia olvidar,0
prensa querer utilizar popularidad concienciar gente suponer ser refugiado querer hacer parte díamundialdelaspersonasrefugiada DíaMundialDelRefugiado,0
sicario año Madrid nuevo peligroso estrategia cabecilla banda latino,0
última hora Argelia denunciar domingo carnicería muerte inmigrante subsahariano Melilla enclave español situado norte Marruecos breve más información,0
salida masivo inmigrante argelino calle haber cortar devolución seguir seguir degradación,0
Madre libro poeta Viva Nicaragua vivir poesía latinoamericano joaquínpaso,0
hora temporada REGGEATON hora Duki feat Mora,0
preguntar refugiado Ucranianos poner alfombra rojo dar tipo ayuda refugiado sub sahariano matar frontera,0
antes terminar guerra mejor pasarer hambre Africa Europa EU RENDICION surrender Paz Z,0
tan lejos hacer tanto andén metro convertir refugio guerra país hoy ver imagen similar Ucrania también Mali Siria Yemen violencia continuo generar grave crisis desplazamiento,0
no hacer falta Riad poder vuelta bandera arcoíris lugar geografía español repleto gente haber venir Africa pensión ver tolerant comprensivo ser,0
Doña Mónica África no poder abortar callar no decir no ser postureo además malo,1
mercado sostenible cacao costa marfil,0
Yo sí creer no convenir ideológicamente ser así comunista musulmán,0
África tropical,0
español apoyar acogida refugiado más allá guerra Ucrania así recoger estudio consultora realizado país motivo DiaMundialDelRefugiado tener lugar lunes junio,0
mogambo notar Ford tomar vacación africano quedar película suyas más impersonal aun así ser clásico tener momentazo narrativamente ir tiro Ava Gardner estar maravilloso,0
tunecina Ons Jabeur final Berlín estar dulce ser duda mejor tenista temporada,0
Fundación Caja Navarra haber organizar semana encuentro reflexionar acogida comunidad ucraniano ucraniana huir guerra país,0
Solo ir pena Sola ir condena Correr ser destino burlar ley Perdido corazón grande Babylon decir clandestino no llevar papel Pa ciudad norte ir trabajar vida dejar Ceuta Gibraltar G,0
Saltar decir rodeo Guinea Ecuatorial pasar Turquía Suiza Cuenca Brasil llegar vez Canarias,0
papel fuera España,1
Varios grammys,0
Yo escape país salvaje musulmán levantamiento primero hacer ser poner salvo familia salvaj no,1
menos subsahariano agente marroquí haber morir asalto valla Melilla haber caer vaguada avalancha haber quedar atrapado poder salir lado español agente GuardiaCivil haber resultar herido,0
ahora sepa tener bloqueado Wismichu Felipez gibraltareño,0
antes pandemia no haber realmente solo sitio bueno fabricación vacuna continente africano estar comenzar hacer cambio allí deber cambiar más rápido,0
maravilloso país estar dejar Sicarios año Madrid nuevo peligroso estrategia cabecilla banda latino,1
Arco Forum recibir viernes Medalla Oro Círculo Intercultural agradecer enormemente CIHAR haber tener consideración labor pro convivencia tolerancia diversidad,0
Comienza Iglesia vivo Cáritas celebrar cumpleaños carita día refugiado celebración CorpusChristi ir África país sufrir inseguridad alimentario hablar labor Cáritas Ucrania,0
vecino ser marroquí venir aquí permiso trabajo montar negocio vivir conforme ley hablar español familia pregúntalir sient señalar siempre metar saco solo venir forma ilegal delinquen estar harto,1
EXMINISTRO INDUSTRIA ARGELINO no tener problema España tener problema Sánchez Ferhat Ait Ali salir hacer año Gobierno argelino hablar crisis diplomático cambio rumbo Ejecutivo español Sáhara sintonía,0
verano estar sombra Alicante ser zona más tórrida Europa haber dos oleada calor sahariano tanto intenso más haber sacudir provincia junio,0
objetivo ser recaudación fondo promover desarrollo infancia más desfavorecido país africano Benin Guinea Conakry Marruecos Mauritania Senegal Togo Mali Jordania,0
Acento árabe emir Catar jeque Abu Dabi,0
acabar recibir ir ser rico heredero guineano necesitar servicio poder acceder jugoso cuantía colaboración llevar,0
Francia señalar Sánchez crisis Argelia Marruecos tener información mujer,0
pasar cristianismo ser altura siglo tener libertad pensamiento ir no ir iglesia cosa contrario pasar país musulmán ser simple opinión,0
cara Ferreras después haber conseguir involucrar Montero matanza Melilla incrustar entrevista subsahariano ser digno guardar hemeroteca porno,0
vivir papel día Orgullo mucho LGTBI ser ser migrant atravesar manifestación alternativo Orgullo Crítico salir martes calle lema papel no haber Orgullo,0
gente saber papel poder entrar mismo evitarir cosa,1
emprender camino vuelta casa Fundación Probitas ofrecer beca emprendimiento ciudadano senegalés residente España hacer eco,0
ver desastre Nador también recordé alumno Guinea Costa Marfil Mali recordé documental cineafricano,0
no ser nada nuevo llamar pan circo ya existir imperio romano GobiernoDeInutiles no jodar mas impuesto comunista mamporrero hacer regalito gran hostia electoral ir camino indocumentada,0
Buen Túnez,0
misión ONU Mali Minusma investigar matanza pasado fin semana Mali,0
pinza,0
ahora rr feijoo autoridad argelino hablar malentendido anular orden suspender turismo España vía,0
estar cosa japonés papel estar meter frontera control,1
playa cierto amigo encontrar época pobre chaval subsahariano empapado aterido acabar bajar patera llevar desayunar camarero portar genial preguntar llegar estación autobús,0
no votar ser evidente buen hacer exterior tema argelino solucionar,0
Ique Árabe perfil griego tener,0
Invasión argelinar cortesía socialismo criminal PSOE Unidas Pandemias Sanchinflas hacer cosa chulísima materia internacional Grazie Antonio VOX soloquedavox EspañaLoPrimero stopinvasiónmigratorio,0
Ah resultar no ser sudacar,1
ver ir portugal ser buen jugador ya internacional Guinea consagrado,0
relación no estar roto haber cesar ministro exteriores argelino declaración,0
Minicircuito Norte Senegal Playas Salida Barcelona Madrid querer saber más no dudser pedirno más información Senegal regalaunviaje vacación viajar lunasdemiel Africa circuito,0
Maniobras León Africano d USA amp socio Marruecos cambio impuesto EEUU Norte d Africa poder desmontar frágil equilibrio Argelia Marruecos poder USA d regalar Sahara Rabat cambio gas argelino UE breve análisis,0
ser ser niña sí indocumentado malo hostia,0
negativo final trabajo coger senegalés así ir demanda trabajo gente paro breva,1
indocumentado entrado ilegal República Antioquia Turbo,0
mirar sonar broma ver acontecimiento reciente Marruecos posicionamiento gobierno ir terminar creyéndome igual móvil presidente haber no deber estar allí rarir sonar,0
Baleares ser tercero provincia más migrant recibir ruta argelino,0
policía marroquí llevar dos semana herida grave uci gurugu quemado Marruecos deber aguantar salir periodista español pagado régimen argelino insultar Marruecos,0
preguntar cuánto aplaudir fervientemente participar acoso calle Gerona camarero latino no hablar catalán,1
Anda mirar hablar jajar piel tanto fino ofender anda ser ejemplo buena manera además no haber decir momento ser árabe musulmán cristiano,0
no ser posible tener antepasado subsahariano,0
Te decir ser comodín Franco Putin ser pobre payaso indocumentado recibir hostia electoral mas neurona comunista no dar cosa pagar negro decir gilipoll recibir hostia electoral,0
día después Bélgica joven transexual tunecino ser apuñalar miembro autoproclamado EI ejecución continuar entonces Siria Irak manos organización terrorista,0
pela día padre latino,1
Programa Fiestas Patronales Moros cristiano Novelda,0
Estáis mucho equivocado seguir ser maltratador ser hombre secta LGTBI seguir adoctrinar depravación sexual niño año moro seguir invadir España visto bueno,0
muerto operación Marruecos impedir acceso inmigrante subsahariano masacre no poder quedar impune,0
ser africo waka waka Contigo empezar,0
razón venir indocumentado ser estar buscado delito ser hecho ahí haber tener cuidado entrar así,1
decir indocumentada idea tener Madrid ser ciudad árbol Asustéalamierda,0
ser bobada no ser respecto niño ambiente rural ir desayunar sociedad subsaharián imponer inglés francés luego tener facilidad lengua día vender artículo playa medit buen castellano,0
Migrar ser derecho no solo caso guerra persecución político también persona huir miseria provocar saqueo expolio colonialismo capitalista occidente empresa África vida negro importar persona ser ilegal,0
ya pasar Mora mamabichoo,0
marzo tener dos rescate primero ser chica hispanoamericán embarazado hablar grupo activista provido allí encontrar ser casa contentísimar decir ir tener bebé,0
Colega eres latino culpa español baja nube,1
ser no ser sea negro latino asiático mujer gay pobre inmigrante musulmar judío puta madre bicicleta,0
Marruecos ser autocracia musulmán no poder criticar cuestionar rey ser gay mostrarte disidente sistema político defender derechos humanos,0
amplio beneficio visitante Magreb venir documento disfrutar ciudad no haber cotizar confección sólo traer intención AGENO no venir trabajar tener obligación mantenimiento total CUAL ser TU OPINION,1
ser argelino novia no existir ser argelino favorito Real Madrid ser Karim ser argelino procedencia verdad familia ser argelino supuesto seguir liga argelino ser fan completamente Argelia gente patria,0
barrio tener suerte convivir senegalés Gente risueño afable Gente además intentar aprender usar euskera seguro más allá sonrisa tener particular infierno no parecer aquí andar sobrevivir,0
Madrid Torre Gavi jugariar partido Castilla Pedri fuera sexto mediocampista detras KCM Valverde amp Camavinga,0
Luchan derecho feto nacer ser mujer LGTB negro musulmán ateo discapacitado quitar derecho,0
Dios verdad pesado ser moro decir quier ser policía poner decir no ser moro querer hacer cojar goma subir península Thaua,0
Eso terminar Marruecos Melilla,0
padre hacer almuerzo coger plato gibraltareño Platos gibraltareño ser papá Llanitos no ir tener humor roto genética,0
antes examen,0
partir conquista América Sevilla convertir centro esclavo más importante mundo allí enviar américa esclavo negro musulmán Isabel Católica no abolir esclavitud durar,0
Buenas tarde existir aviso estado ejecución ayer día referencia saludo,0
avispa saharián piscina,0
español ser conflicto África subsaharián creer ser mucho importante España intentar no estar dentro interés EEUU estudiar,0
Pues favor recuérdamelo xq deber estar despistado no hablar información selectivo siquiera ser creyente parecer perdida tiempo sorprender mucho ahora intentar silenciar costumbre musulmán comparandola,0
España apoyar marroquí gobierno subsahariano argelino provocar entrada ilegal habitante posicionar favor subsahariano gobierno marroquí hacer hacer hacer solo saber dar culo arriba,0
indocumentado,0
no preocupar haber Youtube siempre molo grabar clase ver fallo sí gustar volver bailar requerir concentración olvidar no saber ritmo latino flamenco hacer poquito tbn gustar ya ver,0
Che Peter Viviste Europa asegurar decis vivir madrid ser medico nunca tratar sudacar profesor facultad deciar aplicar vo IGNORANCIA ES ATREVIDA saludo,0
junio día internacional persona refugiado Nicas exilio noestoysola Florecerás Nicaragua libre feminista,0
estudiante ISGlobal compartir experiencia refugiado impacto transición país origen acogida poder causar salud general poder blog HealthIsGlobal DíaMundialDelRefugiado,0
Deportes TENIS clasificación mundial WTA tunecinar Jabeur ser nuevo número,0
no ser indocumentado ig estar incendio jugándome vida hablar perfección saludo,0
dejáseis alimentar mafia descerebrado llamamiento papel Nigeria Senegal superar España sólo entrar legalmente no violentar frontera no ocurririr está desgracia Sois gran medida responsable,1
acusar mafia sucedido Melilla acuerdo hoy valoración amigo mohamedvi líder UnionEuropea ahora investigación independiente ocurrido demostrar haber exceso justicia reparación,0
lado marroquí,0
Alerta CNI alertar Gobierno Argelia preparar avalancha inmigrante ilegal vía,0
Nooooooooo no ver telecinco estar estar Señora Rafa Mora no gustar,0
entonces reivindicar país gay ser discriminado vez favor inmigración musulmán ser asi,0
tratar primero salto volver abrir frontera terrestre país vecino resultado migrant subsahariano gendarm marroquí muerto también haber haber herido miembro Guardia Civil decena migrant lado,0
medio español elucubrar Argelia Marruecos tener ver chantaje personal Sánchez luego medio fuera hacer eco pensar pobre prensa aquí ser serio medio español usar eco argumento autoridad,0
locura concierto no poder ser más top no esperábar invitado sorpresa noche también brutal toque fascinante Flaca volver escuchar vivo Documentos magia,0
cultura paperless ser mejor opción combinar ahorro cuidado medioambiente empresa descubrir principal ventaja oficina papel entrada,0
creer pertenecer árabe ser puntual,0
música también tener cabida dentro jornada estar celebrar Día Mundial Personas Refugiadas artista Jawad Saberi Fernand Diallo reivindicar integración sociedad través estupendo muestra rap,0
vez ganado elecc autoridad argelino hablar malentendido anular orden suspender turismo España vía,0
antes escritor más importante literatura hispanoamericán Ernesto Sábato ser reconocido astrofísico cima carrera Instituto Curie París empezar desamor ciencia,0
Silencio administrativo mediático incluso red guerra salpicar lleno preguntar tardar poder dejar tapar muerte conflicto milicia canal decir ni pío,0
solucionar poner más cámara controlar delito lgtbifobia más agente violeta surtir vigilante ser latinoamericano acusario racista,0
vez nacer menos niño facilidad abortar reducir natalidad musulmana salvar humanidad barriga,0
director Debate haber desvelar COPE conversación general encargado ciberseguridad norteamericano indicar americano saber Pedro Sánchez mucho más grave estar utilizar servicio secreto marroquí,0
Gobierno argelino retirar orden agencia no operar España via,0
coronavirus golpear particular fuerza región brecha ya arrastrábir educación hacer más visible profundo,0
semana visitarer tierra americana cuarto vez continente africano visitar último vez julio año visitar Constantine Argelia perder partido anular gol Nolito,0
France Soir poder ver oír crónica prestigioso medio comunicación crisis Sánchez Argelia también involucración mujer operación droga información obtenido vía Pegasus Gobierno argelino,0
Delirios lider africano,0
elegiste ser canario no guineano,0
llegar dos africana faltar,1
año estar hablar árabe,0
no Arabia Saudí tener rpc mucho mayor además mayoría musulmán,0
imagen haber ocurrir frontera Melilla ser mucho duro respeto vida dignidad persona deber prevalecer encima reclamir VíasSeguras persona migrant refugiado,0
espectáculo autoridad argelino hablar malentendido anular orden suspender turismo España,0
JAJAJAJAJA bro anoche empatizast niño África so hard,0
queréis decir mandar país haber pasar antiguo grupo amigo moro salir calentito también haber saber no grabar tanto,1
argelino acusar Gobierno Pedro Sánchez haber hacer Sahara ser traición vía,0
efemeridesgranadina junio Pedro Fernández Velasco II condir Haro condestable Castilla camarero mayor rey atacar tierra musulmán Montefrío incendiar miés monte cortijo progresivo conquista Granada,0
duda también ser cierto menos asesino mujer tener estudio cultura hispanoamericán tal vez excluir Chile ser mucho machista Mexico Ecuador Bolivia,0
persona entrar frontera argelino fuerza marroquí no retirar replegar lejos barrio no haber víctima civil enfrentamiento Solo pasar melilla Marruecos haber dar cara Esp,0
Programación Fiestas Patronales Moros Cristianos Novelda Vuelven fiesta tres año después multitud evento julio agosto,0
ayer conocí Bamba Joven año Origen Senegalés llegar patera año pasado Laayoune dirección Fuerteventura actualmente encontrar Almería vida Buscando nuevo futuro,0
Revolución Jazmín Revolución Túnez causa consecuencia,0
contestar ser Marruecos actuar siempre así solo haber ver campo refugiado Sáhara ahora actuar así frontera nuevo relación,0
setroi NOTICIAS jueza concluir muerte adolescente centro menor Valladolid ser natural NOTICIAS juzgado instrucción archivo investigación fallecimiento Koussai Dhouaifi joven tunecino act,0
Mañueco pensar CyL ser África Doctor Livingston suponer,0
PATRÓN GRATIS Motivo Margarita Africana Crochet,0
pón foto Marruecos,0
