text,hate_speech
Migración dos país norteamericano aumentar más deportación Cuba ir,0
ojo dato hasta Venecos país sistema huir tesis progr Venezuela ver hacer,0
DELINCUENCIA politico BOLIVARIANA ORGANIZADA querer oro venezolano usurpador creer no ser usurpación,0
Ipsos presentar dato interés preocupar mundo Ipsos GameChangers Refugees Refugiados,0
no saber regla inmigrante Nipón hijo nacido Perú mejor cállate Vomita odio,0
sinceramente ilusionar llegada ya selección clasificación buen participación Copa América bueno obviamente salir volante marca defensa partido Bolivia venezuela haber puteado,0
odar trámite veneco estar migración horror,0
decir VENECOS miré inundar cartilla VERDAD ABSOLUTA hoy vivir miseria adorar demonio muerto sodomizar arruinar ver Krapulita despertar,0
Precios oficial haber Cuba Venezuela ir comprar cubano venezolano no encontrar genio indígena querer precio oficial ser miserable hambre Iza banda ser bruto economía,0
participación Venezolanos Colombia esperar Petro política migratorio inclusivo,0
Siga miopía selectivo haber país más pobre hasta tener constitución EEUU llamar Haití importar ser Colombia acá tener mayor migración desplazamiento mundo gobierno derecha ser millón Miope,0
Migración pandilla venezolano Tren Aragua haber convertir principal amenaza Sudamérica ser Chile último destino investigación InSight,0
Fiestas Patrias conocer aquí sed Migraciones atender feriado largo,0
Chocó vídeo aficionado registrar angustioso rescate selva Darién departamento migrante bebé ser arrastrar corriente río tpnoticia G,0
atentar migración cuidado Fronteras ir haber fuga RATAS,1
participar Mesa Diálogo organización Cooperación Internacional asociado Grupo Trabajo Refugiados Migrantes GTRM socializar proyecto estar ejecutar ciudad Guayaquil,0
Fiestas Patrias sed Migraciones atender feriado largo conocer aquí ser,0
veneco venezolano calle acorralar no quedar más entregar cosa Venezuela DeVenezuelaPienso,1
ley veneco poner Neutro Shorty volumen,0
momento amiga chama gym ya no saber preséntame ñaño preséntame papi,0
noticiascapital fin prestar asistencia humanitario refugiado llegar Bogotá junto Consejo Danés fortalecer estrategia defender derecho migrant,0
CNP exigir publicación anteproyecto reforma ley regir periodismo vía,0
participación Lanzaron plataforma Hermanos Venezolanos apoyar migrant infobae,0
tratar ser mucho comprensivo venekos quejar derecho laboral humano Perú quejar ser feo ser frío gana no faltar no larga Xdddd,0
telenovela venezolano,0
Pequeñas oquendo no ser periodista,0
Chamo llorir Serio,0
irani ir producir alimento bien hecho ya veneco ser perezoso trabajar campo,1
mierdero chama,0
hoy joven venezolano mucho lindo preguntar tener carton vidrio ser recicladora ser mayor hermana recicla plata familia todavía estar venezuela no tocar putiar comer,0
violación derechos humanos reciente caso implementación Instructivo ONAPRE atropellar derecho salario trabajador también necesitar país recibir migrant ayudar regular situación,0
poder ser cruel chama intensidad tipo eh salir correr,0
Cansado ver Venecos tierruo Usa aquí poder salir aún Latinoamérica,1
tristeza chamar ir Venezuela ver favor Mérida no querer ir Maracay,0
regresar Cali empezar ser profe acá no haber tener solo grupo no haber menos estudiante familia ser migrante forzado litoral Pacífico tener guerra cotidianidad maldito sea,0
ver no saber fútbol gol Marco ir balón siquiera golpear salir video gol ver revisa gol venezolano ser offsidir estar var,0
humor tiktoker venezolano ser mucho buen,0
hora informe Venezuela MundoDeportivoEC noche Sudamericana vs trabajar sentido nacional,0
Madurazo libre Venezuela,0
This to my folder veneco hacer cosa rara,0
TragediaEnNicaragua manera milagroso pequeño bebé venezolano sobrevivir trágico accidente noche ayer padre Jordán José Castellano Castillo Cinthia Ninoska Estaba Rojas lamentablemente perder vida,0
Jajajajaja IDV ser campeon año Venezuela ser Caracas jajaj,0
veneco,1
Líbano inestabilidad reportado silo puerto actividad acontecer alrededor Estatua Inmigrante este terminal estar línea visión zona cero BeirutBlast beirutexplosion,0
utilizar palabra veneco estar Venezuela no deber tener acceso playa lugar turístico pagar triple ser buen castigo faltarl respeto hermoso país gentilicio,0
ATENCION Bogota ver mañana parque CayetanoCañizares partir pm ferio colombiano retornado migrant venezolano UnidoPorLaIntegración,0
DEPORTEN ESE veneco impedido MIERDA,1
Chamo Baires,0
valle derrotar Deportivo Táchira cuarto final CopaSudamericana equipo ecuatoriano lograr ventaja importante tierra venezolano más información,0
tirar mano bermudez tonguir saludo Venezuela,0
ConectandoCaminosPorLosDerechos más millón migrant haber grupo poco hablar colombiano retornado Repaso derecho político,0
has poder ahorrar vida migrante Perú querer conocer experiencia ser post informativo noticia más importante hora comunidad venezolano Perú,0
EnVivo Migraciones informar julio no haber atención sede principal Breña panamericanatelevisión panamericananoticia más detalle,0
migración estar cantar voz cuello Crimen Cerati no atender,0
No solo ahora tricimotor carreta reciclaje motor MOTOS robado parte arman documento no respetar norma tránsito mano duro,0
Representante Espaillat explicar detalle posible futuro Ley Registro inmigrante,0
Estás buscar no ser buscar apasionir poder compartir chama ir ser,0
ya explicándome audio video significar shoujo xd Tkm chamar ahora sueldo siempre correo peligro haber descuento mangas,0
chamo expliquenmar hacer decir caer mal subir foto persona diosmiir tengar no gustar ya estar marcar millo xddd,0
ser ir sacar abajo solo no aguante chamar doler mandíbula dr costar,0
Hola Daniela gustar ver respuesta tener hermoso recuerdo trabajo Salta favor refugiado abrazo,0
Migraciones conocer sed tramitar pasaporte julio,0
Chama no zap conto,0
ratificar compromiso lealtad pueblo venezolano brindar seguridad resguardo PuebloEnUniónNacional GuardianesDelPueblo,0
NoticieroW retoma relación Venezuela no ser noche mañana exembajador Ricardo Lozano,0
aproximar crecimiento balanza comercial país deber sí probablemente ya haber leer noticia nuevo gobierno tener disposición retomar relación Venezuela ser decisión oportuno esperer sí,0
España suavizar regla inmigración,0
familia inmigrante ser xenofar jum the audacity,0
agradecer visita acompañamientir proyecto ACNUR Buenaventura tener oportunidad conocer proceso comunitario institucional acompañar distrito protección comunidad refugiado desplazado,0
nuevo tipo refugiado mujer víctima violencia basado género,0
así ser Chamo dejate robarte plata,0
migrante año haber apostar convertir vagón sistema transporte público aula clase usuario apasionir historia Bogotá Colombia,0
opinión migrante venezolano ex dirigente social país creer tiempo dar razón opinión particular ser mejor pasado Colombia solo tiempo decir Petro no pasar mucho cuenta,0
Estatuto Temporal Protección buscar proteger población migrante condición irregularidad marco regulatorio buscar ofrecer resguardo persona huir país origen causa crisis Visibles HazteVisible,0
DataCrédito lanzar plataforma validar identidad migrant venezolano,0
Guaidó ganar batalla Maduro Reino Unido puja oro venezolano via móvil,0
CJ participación ceremonia reconocimiento Premio Sentencias Acceso Justicia Personas Migrantes Sujetas Protección Internacional DirecciónAccesoCJ,0
querer pasta seco venezolano sitio hacer allá,0
ampliación CONVOCATORIA POSTULA GESTOR PROYECTO educación atención migrant REFUGIADOS UNESCO PERÚ más información convocatoria agosto,0
abrir puerta inmigrante pagar Cuentas claro,0
así es Q FUIMOS DESTERRADOS HUMILLADOS ROBADOS ABANDONADOS SABEMOS Pdte Correa transformar Patria sembrar obra doquier dar dignidad igualdad oportunidad Regresé doloroso migración forzado estudiar postgrado BECADA RAFAEL,0
tequeño ser malo no tener casi queso venezolana vender tener tremendo derrière,0
Camina acompañado llegarás lejos agradecimiento especial equipo ser aliado estratégico trabajar junto Derechos LGBTIQ población migrante acogida Ecuador ir más,0
VIDEO Breña continuar larga cola sede central Migraciones,0
aeropuerto Jorge Chávez no pedir carnet vacunación ingreso pasar migración puerta embarque,0
mapa refugiado guerra Ucrania más millón persona haber abandonar país vía,0
Migración Queman pertenencia migrant venezolano Chile más,0
selectivo veneco arepa ser mandar Maduro,0
inmigrante ghanés mata matrimonio Ferrol,0
Migrante casi morir bebé brazo tratar cruzar Tapón Darién impactante video,0
ayer sumar estrategia centrosintegrate impulsar ya ser ciudad dar salto integración espacio ofrecer servicio población migrante acogida Bienvenida,0
ser mil millón mil millón paz billón asignado Char desfalcar sistema salud punta acetaminofén tons oro vendido hacer dos año dar ONU comunidad europeo migrante venezolano,0
Colombia sólo ir alcanzar colombiano,0
actual oposición no representar Uds solo ser aprovechar familia interés Venezuela deber cambiar completo tanto oposición gobierno,0
Escándalo Colombia Investigación detectar contrabando petróleo venezolano través infraestructura Ecopetrol Detalles,0
ONU Venezuela persistir necesidad humanitario,0
sencillamente venezolano,0
Hay Argentina Dios ser socialismo siglo xxi asco no ayudar salir adelante simplemente volver pobre Cuba Venezuela igual defensor pueblo oprimido no faltar solo comida ser archi millonario VERGÜENZA,0
Canciller designado reúnir homólogo venezolano frontera,0
Tiras Pdi encontrar Venezolanos Rengo papel irregular tbn haber pegar mil Venecos irregular,1
desgracia proceso embarque internacional Aeropuerto Jorge Chavez Demoré hrs llegar avión casi pierdo fila gigantesco check migración gente perder vuelo injustamente deber hacer,0
creer nigun momento hablé vandalismo lider social no soler hacer vandalimo hacer ayer ser libre expresión sencillamente parecer vadalismo váyar Venezuela allá libre expresión también ser vandalismo,0
traficante persona lanzar niño migrante año alto muro fronterizo San Diego California frontera México caer herido también pasar niño migrante tres año,0
Venezuela mayúscula realmente saber significado palabra veneco no verdad,0
ver entregrado no tienen idea agradezco imigracion masivo momento,0
Confúndelos reinarás EEUU ir poner pelear chino taiwanés hacer ruso ucraniano negocio Colombia haber caer también poner pelear Venezuela tonto no aprendar,0
No solo motor afectar medio ambiente haber incrementar inseguridad hurto motocicleta ya ser motor documento,0
creer mafia bicitaxi ser fuerte pasen miren ORDAS colectivo PIRATAS SIN PAPELES MAL ESTADO paradero ser lado CAI lado operativo d extrañamente hacer NADA mañanasblu,0
resaltar normativa señalar participación vigilancia ciudadano ser fundamental lucha fenómeno nocivo sociedad Mociona aprobar resolución contra trata tráfico ilícito migrant leycontratratapersona,0
migrante año ser reportar desaparecido cuerpo joven ecuatoriano ser hallar estado descomposición,0
migración riesgós ser tema doloroso país tráfico persona ser estructura criminal más grande mundo cantidad recurso mover,0
haber venezolana mucho rico no haber ver ser unicornio haber venezolana mucho rico,0
cojudo Lasso querer dar nuevo regularización venezolano delincuente disfrasado refugiado indocumentado deportación control migratorio avispatar más parado ser Lenin,1
ya empezar réplica milicia venezolano paramilitar ser Uribe estar también tener JEP,0
afirmar no haber impedimento Calidad especial obtener CPP M,0
pena estar señora decir ser venezolano,0
tamaño bruto migrant arrojar no ser Texas Idaho primero tener población millón segundo no llegar millón,0
Empresa venezolano minería obtener certificado oficial Whatsminer mantenimiento,0
haber trabajar profesionalmente no poner mochilero inmigrante enemigo club formar guardameta institución ser sólo caso ignora cantera quieres hacer cosa bien pon ejemplo terminar palanqueo adentro,1
ser generar más vagancia Venezuela luego salir país mendigar robar hijo dar bono no saber trabajar,1
tener razón idea bajo costo humano sonar utópico menos pensar refugiado soldado poder recorrer mundo,0
llamar migración supervivencia septiembre economía deprimido desempleo rampante salud desastroso inoperante corrupción político policial militar gubernamental inseguridad no vivir EcuadorDeLasOportunidades,0
Chamo criar mano duro padre QEPD hacer experto ser psicópata persona malo aquí estar más normal tranquilo hasta depinga decir ser ser hermano ser diferente decir decir,0
haber ser engañar supuesto oferta laboral tvcecuador,0
Wuauuuuuu joven migrant titulo no poder hacer maestría pedir santo limosna,0
no servir servir hacer postgrado Venezuela mínimo maltrato salir grosería célebre Bogotá,0
Vaya lenta ser cola SAT Mex ser más larga cola Migraciones Perú,0
incluir extranjero dar salud gratis educación hijo grati tender alfombra rojo banco crédito Venezolano ser marginado dar cédula ciudadanía estar legal,0
influencer venezolano mucho famoso Marko decir semana ya no generar contenido polémica,0
VIDEO Migrante bebé ser arrastrar río pleno Tapón Darién,0
cuidado nomás entrega tesorito chamo,0
Leí hilo buenísimo trabajar refugiado ropa no donar disfraz payaso Reply polémica respecto claro ser refugiado no tener derecho disfrazarte Twitter ser universo paralelo no existir comprensión lector,0
Breña retomar atención Migraciones,0
chama motera imaginar Gilberto,0
Tramita pasaporte conocer sacar cita adicional Breña horario atención sed Lima,0
así Ysaias haber mil refugiado buscar nuevo oportunidad emprender lograr sueño unidospalante requier orientación haz aquí,0
Guatemala detener fin extradición cuatro presunto traficante migrant acuerdo Naciones Unidas migrant cruzar frontera México Estados Unidos morir,0
pobre imber be pedir favor migración tiempo calabaza mujer encontrar no habidir país alcahuete padre creer ser cuestión hacer llamadita salir tiro culata tirar dedo,0
no sentar mal mundo odiar migrante pobre ejemplo pais destestar venezolano tener chile españa odiar dominicano suceder mundo,0
Yuberjen Martínez ganar KO tres asalto venezolano Yeison Hernández debut profesionalismo,0
no haber todavía,0
Migraciones conocer aquí tramitar pasaporte julio,0
sí claro también tener abierto frontera colombo venezolano,0
Canadá recibir inmigrante residencia permanente país tener economía depender vez más inmigración reporte anual destacar inmigrante estar presente casi tipo trabajo salud tecnología sector más,0
Jajaja oir hoy no ser cumple fecha poner inmigrante llegar papel no supiera pregúntalir tío Vlady,0
Atención gobierno Duque ratificar no haber representación venezolano posesión Gustavo Petro Nicolás Maduro Juan Guaidó asistir evento próximo agosto meridianoblu,0
celoso no quedar país México no servir dejar inmigrante par tranquilo no ser tanto inhumano estar contra muro Estados Unidos ahora poner paja arriba haber dios Gonorreas,0
democracia ser mentira chamo,0
ser migrante venezolano gustar estudiar Sena MigraVenezuela,0
haber falta prioridad parte Estado venir antes no haber política Estado autoridad mencionar tema poner incómodo sostener migración irregular visavisennotihoy,0
venezolano querido disputar partido ser titular convertir gol copa más recordado ser vs Rosario Central aportar increíble remontado,0
pobre niña decir aquí gente ser mucho lindo baboso aca ser venezolano Coman mierda LaVozKids,0
mucho buen propuesta agregar oposición recurso donación ayuda inmigrante realmente necesitar no robir haber hacer haber largo año,0
ENVIVO noticiascapital fin prestar asistencia humanitario refugiado llegar capital junto Consejo Danés fortalecer estrategia defender derecho migrant acompáñano,0
CONVOCATORIA dentro poco INICIAREMOS programa super cheverar dirigido adolescente joven peruano venezolana activista buscar fortalecer capacidad incidencia comunicación defensa derecho vida libre violencia,0
no poner acuerdo haber comunismo no haber comunismo chamos causa Tizana emoliente,0
ser dos extranjero estadounidense venezolano busca servicio telefonico Colombia dejar nombre menos funcionir haber posibilidad,0
lado tener veneco estar hablar pasaporte estar oido parao,0
hablar daddy issu chama tener amor obsesivo dependencia papás,0
Kieres ver video pene haber ir hermoso chama haber ver henamora,0
Migrantes ser forma administración Biden brindar apoyo humanitario venezolano país extranjero junto socio regional Alejandro Mayorkas secretario Seguridad,0
dos persona proveniente Bogotá dos rolo poner pelear frente situación conjunto tener sorprender capacidad no medio rabia razón veneco ser marginal comparado jfjakka,0
Pa empezar chamo no dar ni hora jsjsjsjd chamo pasado vuelta jeva mal,0
ser inmigrante ucraniano no juzgo policía contrario protegería racismo recalcitrante institución europeo ser enfermizo,0
Mamahuevo pasar chamo,0
Castillo regresar Chota luego año fugar refugiado exterior CastilloLaPrisionTeEspera VacanciaPresidencialYa M,0
igual PP hacer ETA víctima estrategia ganar voto banco grande empresa utilizar conflicto Ucrania persona refugiado parte estrategia marketing no ayudar humanidad poder reportar,0
Acnur Lima ser ciudad albergar más refugiado migrant venezolano mundo,0
Doy fe Reniec Migraciones estar yendo diablo suceder antes funcionar bien demora siempre haber no tanto ayer ir tramitar renovacion caducidad ser infierno siquiera app biofacial funcionar avanzar mal peor,0
así ecologista europeo poner encrucijada actual UE depender recurso natural estado totalitario Ruso Uds querer hacer dependient recurso natural dictadura Venezolana así reclamar democracia,0
no meta país mal aquí comar piña ser chamo llenar pasto salsa saltina poner ripio lechuga jaajjajajajajjajjajajjajajjaja,0
modo venecir,0
Tapón Darién ser ruta utilizar refugiado migrant más peligroso mundo,0
ser obvio haber migración extra ahora haber pagar más subsidio no saber análisis hacer súper tener precio alto competitivo creer mantener consumo no dar subsidio extra,0
Marrchantee lobo mar OnlyOne Chimichagua SuperNumerario contador FMG Flota Mercante GranColombiana naviera PactoAndino Colombia Venezuela Ecuador traer viaje oficina camarote buque usamo reingenieriasocial,0
acabar pensar realidad no deber odiar no querer cambiar solo no querer cambiar incluso ser persona mierda,0
doctora Kriti Mohan ser cirujana plástico hoy ser cabeza máximo Ciaravino Total Beauty embargo camino éxito tener recorrer inmigrante proveniente India no haber ser fácil ser historia,0
hincha ser reconocer labor ayuda refugiado guerra Ucrania,0
SueñoAmericano Servicio Nacional Fronteras Panamá lograr rescate dos ciudadana venezolano haber extraviar SelvaDelDarién ambos mujer encontrar herido ser traslar centro salud Jaqué recibir atención médico,0
diferenciar haber muerto huérfano refugiado loca destrucción venir nombre totalitarismo sagrado nombre libertad Gandhi OscarVásquezC,0
gustar conocido escuchar trap venezolano fdj,0
LéaloEnET España anunciar reforma Ley Extranjería favorecer migrant incluir ecuatoriano,0
ejercer autoridad mandé ESMAD ser transporte ilegal mayoría ser conductor venezolano ilegal delincuente,1
Texas Arizona envir autobús mil migrant Washington DC desbordar servicio capital,0
dedicar recorrer Europa limosnero pedir recurso atender venezolano vacuna COVID paz decir no gustar nada regalado,0
asqueroso lleno pésimo,1
resolución sacado hoy Julio Venezolano querer entrar colombia deberar digilenciar permiso visa,0
Claro también resto país cerrar frontera mil ecuatoriano migrant no ocurrir antes,0
burdel Piura Perú ser destino final mujer ecuatoriano peruana venezolana colombiana red trata persona fin explotación sexual ser captar través anuncio Facebook también haber menor edad,0
lomásleído Yilbert Pérez venezolano enseñar historia bus Bogotá,0
sólo dictadura derecha indignar Cuba Venezuela Centroamérica ser revolución Anahí fanático,0
Prevén más migración venezolano,0
creer tener mostrar poquito más no exhibir mercancía no vender Feliz madrugada,0
Goce poder después llorar chileno argentino venezolano peruano nicaragüés tanto atrevido ser ignorancia infinito estupidez resentido crónico razón ser capaz morir tal ver perjudicado objeto odio,0
pan horno elaborado maíz cariaco tostado ingrediente principal torta Bejarana época colonial venezolano tal vez poco conocido llamar atención publicación,0
total respuesta pregunta decir colombiano peruano decir veneco ser ladrón no generalizar mas predicar ejemplo ser mejor mas sano poder hacer tumbar muro prejuicio,0
MigraVenezuela Rostro Caribe promover buena práctica periodista cobrar migración,0
dios poder así perrito verdad chamo animal tanto inocente tanto lindo siempre mover colita no saber afectar pana,0
invitamos Jornadas gratuito formación promoción sensibilización derecho garantía población necesidad protección internacional refugiado retornado pnpi apoyo Inscríbete,0
MOMENTO EMOTIVO Paul Stratton ser hincha Everton auto haber entregar suministro refugiado ucraniano amistoso Dinamo Kiev Lampard dejar ingresar patear penal,0
Horario publicado página oficial migración no corresponder real MAC Jockey plaza iniciar operación vs horario publicado,0
venezolano subir TM decir ser profesional llevar no más semana haber llegar ya tener libreto bien organizado,1
no parecer desgarrador ver migrante venezolano casi morir ahogado bebé brazo cruzar tapón Darién ruta mil haitiano venezolano africano pasar llegar Panamá ahí Estados Unidos t,0
no saber historia cumpleaños presidente nacer dentro barco inmigrante japonés mar luego agradecer patria acoger colocar fecha Julio realidad ser japonés página ingreso desaparecer,0
DeVenezuelaPienso ser necesario romper cerco proteger colombiano estar expuesto condición fronterizo,0
grupo disidencia parecer hostigar subestación policial zona rural municipio Panfleto amenazar venezolano VeaLosDetalles,0
Niño venezolano estar voz kids sufrir nuevo drama familiar ser mucho fuerte,0
Tribunal Reino Unido negar gobierno Maduro acceso reserva oro venezolano,0
Bicitaxista sinónimo gamin veneco,1
Siglo xxi Inglaterra robar más tonelada oro Venezuela decir más probar colonialismo continuar,0
poco veneco voz kids,1
vez mujer hacer comentario despectivo mi mujer cabeza solo pasar Chama YA ser estar escuchar pana decepcionar maaal,0
historia venezolano Estudie UCV compañero venir Higuerote Valles Tuy Victoria ir Universidad Filas Mariche haber hacer grande esfuerzo progresar grupo delincuente tomar poder,0
Comisión Verdad Colombia presentar informe refugiado Quito,0
dar gran bienvenida aliado ACNUR Agencia ONU Refugiados proteger persona forzado huir hogar causa conflicto persecución,0
persona haber llegar Estados Unidos haber colombiano venezolano haitiano centroamericano nacionalidad,0
Sabores mucho venezolano Candelaria,0
EnVivo Chávez ser mucho popular Venezuela acabar país Gobernar significar tomar decisión impopular presidente Iván Duque hablar RedMásNoticias Canal Claro vía,0
sí no poder conocer mundo título funcionar señal característica poder valioso Canadá Australia usar sistema punto título contar permitir migración,0
rescatar migrant venezolano tres migrant venezolano ser rescatar luego naufragar río Orinoco embarcación navegar hundierar sector cercano comunidad Casuarito departamento Vichada,0
lindis yanqui recibir refugiado ucraniano más grupo medio oriental latino poner mil,0
fiscalía Comité Municipal Lucha Trata Personas Comité Interinstitucional Lucha Trata Personas Ministerio Interior Migración Colombia Ministerio Defensa Consejería Presidencial DH Consejería Presidencial Equidad,0
Confirmo dia hoy llamada correo,0
mayoría inmigrante ser latinoamericano advertir mil vez no votarar socialista castrochavista ignorante primero votar extremo izquierda volver país después ir ilegal capitalismo,0
Lugar emigran veneco lugar convertir cloaca delincuente,1
absurdo relación dos Países ser tanto Chávez maduro no reconocer deuda empresa venezolano buena rata quebrar dejar deuda multimillonario cuidado gobierno ladrón,0
megamillonario puente unir Colombia Venezuela demorar año,0
Inmigrantes posiblemente legal pelear metro querer inmigración legal,0
presente primero reunión presencial plenario GTRM junto conocer esfuerzo protección integración migrant refugiado,0
hoy no solo ganar cielo infierno tambien xdd jajajajajajar ayudar quedo papel baño xDD demorar culo camino encontrar conocido xdd,0
España suavizar regla inmigración falta mano obra,0
ser triste vivir rebusque pagar mayoría no respetar echar encima no hablar prestar robar hacer maricada suba solo ser veneco mirar subir robar,1
Migraciones más mil pasaporte electrónico entregar campaña Fiestas Patrias,0
ahora cerrar frontera poner migración alerta máximo peligro FUGA MASIVA población mentenguir ojo bien abierto movimiento extraño rostro conocido cerca frontera,0
migranteecuatoriano migranteecuador Nueva publicación Noticias migrantes Ecuatorianos amenaza inseguridad atentar estabilidad sistema democrático Diario Hora ahora MigrantesEcuatorianos NoticiasDeEcuador,0
Brutal no saber difícil ser ser migrante,0
DeVenezuelaPienso Colombia deber regularizar migración Venezolanos exigir mínimo requisito identificación llegar no permitir ilegal indocumentado ingresen país,0
tanto cobarde conchudo padre creer llamar migración calabaza Rivadeneyra salvar tener esperar mortal Nariz payaso Hart no olvid tener hija vida pasar factura así controlar hocico cobarde,0
JAJAJAJAJAJAJAJAJJAJAJAJAJA chamo,0
